no,id,text,token_1,token_2,polarity
193,11829b23-4413-4935-93ca-b1c09ab64797,"Sekarang pesan gofood jadi tambah mahal lebih mahal dari pada beli ke restonya belum beban biaya aplikasinya untuk pengembangan aplikasi tapi tetap gini"" ajh ya ?? jadi mikir 2x mau pesannya tolong di kaji ulang","['pesan', 'gofood', 'mahal', 'mahal', 'beli', 'restonya', 'beban', 'biaya', 'aplikasinya', 'pengembangan', 'aplikasi', 'gini', 'ajh', 'ya', 'mikir', 'x', 'pesannya', 'tolong', 'kaji', 'ulang']","[('pesan', 'gofood'), ('gofood', 'mahal'), ('mahal', 'mahal'), ('mahal', 'beli'), ('beli', 'restonya'), ('restonya', 'beban'), ('beban', 'biaya'), ('biaya', 'aplikasinya'), ('aplikasinya', 'pengembangan'), ('pengembangan', 'aplikasi'), ('aplikasi', 'gini'), ('gini', 'ajh'), ('ajh', 'ya'), ('ya', 'mikir'), ('mikir', 'x'), ('x', 'pesannya'), ('pesannya', 'tolong'), ('tolong', 'kaji'), ('kaji', 'ulang')]",-1
194,7399b21d-d174-4892-9c00-b12587769a39,Jadi gak jelas sejak ada PrivyID....OTP sudah di isi sesuai dengan yg masuk di SMS...Tapi selalu di bilang tidak sesuai....tolong di perbaiki... terima kasih,"['gak', 'privyid', 'otp', 'isi', 'sesuai', 'yg', 'masuk', 'sms', 'bilang', 'sesuai', 'tolong', 'perbaiki', 'terima', 'kasih']","[('gak', 'privyid'), ('privyid', 'otp'), ('otp', 'isi'), ('isi', 'sesuai'), ('sesuai', 'yg'), ('yg', 'masuk'), ('masuk', 'sms'), ('sms', 'bilang'), ('bilang', 'sesuai'), ('sesuai', 'tolong'), ('tolong', 'perbaiki'), ('perbaiki', 'terima'), ('terima', 'kasih')]",-1
195,374d86b9-1fc3-426b-9de9-a80058524ae3,"sekarang gofood hanya bisa menggunakan 1 voucher aja, kalo sebelumnya bisa digabung (2 voucher). coba di perhitungkan lebih cermat lagi, kalo misalnya tidak pakai voucher, harganya bisa sangat mahal (ongkir bisa sampai 18 ribu) belum jasa aplikasinya. total ongkir kalo ditambah jasa aplikasi udah sangat tinggi biayanya. kalo tidak ada voucher, jujur saja saya lebih memilih tidak menggunakan gofood karena bisa sangat mahal. mohon dipertimbangkan hal ini untuk pengembang aplikasi. terima kasih","['gofood', 'voucher', 'aja', 'kalo', 'digabung', 'voucher', 'coba', 'perhitungkan', 'cermat', 'kalo', 'pakai', 'voucher', 'harganya', 'mahal', 'ongkir', 'ribu', 'jasa', 'aplikasinya', 'total', 'ongkir', 'kalo', 'ditambah', 'jasa', 'aplikasi', 'udah', 'biayanya', 'kalo', 'voucher', 'jujur', 'memilih', 'gofood', 'mahal', 'mohon', 'dipertimbangkan', 'pengembang', 'aplikasi', 'terima', 'kasih']","[('gofood', 'voucher'), ('voucher', 'aja'), ('aja', 'kalo'), ('kalo', 'digabung'), ('digabung', 'voucher'), ('voucher', 'coba'), ('coba', 'perhitungkan'), ('perhitungkan', 'cermat'), ('cermat', 'kalo'), ('kalo', 'pakai'), ('pakai', 'voucher'), ('voucher', 'harganya'), ('harganya', 'mahal'), ('mahal', 'ongkir'), ('ongkir', 'ribu'), ('ribu', 'jasa'), ('jasa', 'aplikasinya'), ('aplikasinya', 'total'), ('total', 'ongkir'), ('ongkir', 'kalo'), ('kalo', 'ditambah'), ('ditambah', 'jasa'), ('jasa', 'aplikasi'), ('aplikasi', 'udah'), ('udah', 'biayanya'), ('biayanya', 'kalo'), ('kalo', 'voucher'), ('voucher', 'jujur'), ('jujur', 'memilih'), ('memilih', 'gofood'), ('gofood', 'mahal'), ('mahal', 'mohon'), ('mohon', 'dipertimbangkan'), ('dipertimbangkan', 'pengembang'), ('pengembang', 'aplikasi'), ('aplikasi', 'terima'), ('terima', 'kasih')]",-1
196,5db80862-5558-412a-a929-148002fe7787,Sudah satu bulan ini app tidak bisa dibuka. Sudah di perbarui ke versi terbaru juga di install ulang tapi tetap tidak dapat di buka. Padahal sebelumnya tidak ada kendala,"['app', 'dibuka', 'perbarui', 'versi', 'terbaru', 'install', 'ulang', 'buka', 'kendala']","[('app', 'dibuka'), ('dibuka', 'perbarui'), ('perbarui', 'versi'), ('versi', 'terbaru'), ('terbaru', 'install'), ('install', 'ulang'), ('ulang', 'buka'), ('buka', 'kendala')]",-1
197,86aaa493-25a4-4895-baf8-d84f4cf6f956,Kenapa vocer potongan sudah tidak bisa digunakan sama vocer resto padahal sebelumnya bisa. Padahal sudah pengguna sejak tahun 2019 dan banyak vocer potongan yang terbuang sia-sia. Tolong untuk vocer bisa digabung kembali ya :(,"['vocer', 'potongan', 'vocer', 'resto', 'pengguna', 'vocer', 'potongan', 'terbuang', 'sia', 'sia', 'tolong', 'vocer', 'digabung', 'ya']","[('vocer', 'potongan'), ('potongan', 'vocer'), ('vocer', 'resto'), ('resto', 'pengguna'), ('pengguna', 'vocer'), ('vocer', 'potongan'), ('potongan', 'terbuang'), ('terbuang', 'sia'), ('sia', 'sia'), ('sia', 'tolong'), ('tolong', 'vocer'), ('vocer', 'digabung'), ('digabung', 'ya')]",-1
198,9aaf56f4-b3d1-4ca9-86f1-c4f8ad33a163,"saya tidak bisa upgrade ke gopay plus, sudah lebih dari 5x mencoba, padahal eKTP saya sudah sesuai dengan dukcapil, saya sudah WA dan Email dukcapil, data nya benar tidak ada kesalahan, tetapi mengapa saat saya mengupgrade Gopay ke Gopay Plus malah bilangnya ""data tidak sesuai dengan dukcapil"" tolonggg fix permasalahan ini..","['upgrade', 'gopay', 'plus', 'x', 'mencoba', 'ektp', 'sesuai', 'dukcapil', 'wa', 'email', 'dukcapil', 'data', 'nya', 'kesalahan', 'mengupgrade', 'gopay', 'gopay', 'plus', 'bilangnya', 'data', 'sesuai', 'dukcapil', 'tolonggg', 'fix', 'permasalahan']","[('upgrade', 'gopay'), ('gopay', 'plus'), ('plus', 'x'), ('x', 'mencoba'), ('mencoba', 'ektp'), ('ektp', 'sesuai'), ('sesuai', 'dukcapil'), ('dukcapil', 'wa'), ('wa', 'email'), ('email', 'dukcapil'), ('dukcapil', 'data'), ('data', 'nya'), ('nya', 'kesalahan'), ('kesalahan', 'mengupgrade'), ('mengupgrade', 'gopay'), ('gopay', 'gopay'), ('gopay', 'plus'), ('plus', 'bilangnya'), ('bilangnya', 'data'), ('data', 'sesuai'), ('sesuai', 'dukcapil'), ('dukcapil', 'tolonggg'), ('tolonggg', 'fix'), ('fix', 'permasalahan')]",-1
199,95ec28f8-9e5c-46b0-9457-666548d71968,"Bolak balik install dan uninstall tetep sj error, pls ada saldo ku di situ.... Kt cs hp tidak support, sdh gonta ganti hp baru ttp http 400 dll.....malah jadi ribet, dulu2 ga. Terbaru...Ok, sudah ikuti semua instrusi blm bisa juga, belum selesai masalah minta penilaian, login saja blm bisa.... NIAT GA APLIKASINYA, BIKIN NAIK DARAH, SUDAH SETAHUN, ADA SALDO SAYA DISITU.!!!!!!,,.......sampe sekarang tidak bisa dan tidak ada solusi, catat ini sdh tahun 2022 Sudah Sept 2022 tidak ada solusi Jg","['bolak', 'install', 'uninstall', 'tetep', 'sj', 'error', 'pls', 'saldo', 'ku', 'situ', 'kt', 'cs', 'hp', 'support', 'sdh', 'gonta', 'ganti', 'hp', 'ttp', 'http', 'dll', 'ribet', 'ga', 'terbaru', 'ok', 'ikuti', 'instrusi', 'blm', 'selesai', 'penilaian', 'login', 'blm', 'niat', 'ga', 'aplikasinya', 'bikin', 'darah', 'setahun', 'saldo', 'disitu', 'sampe', 'solusi', 'catat', 'sdh', 'sept', 'solusi', 'jg']","[('bolak', 'install'), ('install', 'uninstall'), ('uninstall', 'tetep'), ('tetep', 'sj'), ('sj', 'error'), ('error', 'pls'), ('pls', 'saldo'), ('saldo', 'ku'), ('ku', 'situ'), ('situ', 'kt'), ('kt', 'cs'), ('cs', 'hp'), ('hp', 'support'), ('support', 'sdh'), ('sdh', 'gonta'), ('gonta', 'ganti'), ('ganti', 'hp'), ('hp', 'ttp'), ('ttp', 'http'), ('http', 'dll'), ('dll', 'ribet'), ('ribet', 'ga'), ('ga', 'terbaru'), ('terbaru', 'ok'), ('ok', 'ikuti'), ('ikuti', 'instrusi'), ('instrusi', 'blm'), ('blm', 'selesai'), ('selesai', 'penilaian'), ('penilaian', 'login'), ('login', 'blm'), ('blm', 'niat'), ('niat', 'ga'), ('ga', 'aplikasinya'), ('aplikasinya', 'bikin'), ('bikin', 'darah'), ('darah', 'setahun'), ('setahun', 'saldo'), ('saldo', 'disitu'), ('disitu', 'sampe'), ('sampe', 'solusi'), ('solusi', 'catat'), ('catat', 'sdh'), ('sdh', 'sept'), ('sept', 'solusi'), ('solusi', 'jg')]",-1
200,bd898ed1-cbcd-4cf5-87ac-f042f405ccf9,"Diliat dari aplikasinya, Tampaknya menarik. Tpi dalamnya sangat buruk, klo mau kasih alamat ribet, Klo sudah masuk keranjang tpi Tdk dibeli gk bisa dihapus pesanannya, Jaringan bagus tpi lemot. Pokoknya Buruk lah, Klo sudah diperbaiki nanti ku kasih bintang 5 Deh","['diliat', 'aplikasinya', 'menarik', 'tpi', 'dalamnya', 'buruk', 'klo', 'kasih', 'alamat', 'ribet', 'klo', 'masuk', 'keranjang', 'tpi', 'tdk', 'dibeli', 'gk', 'dihapus', 'pesanannya', 'jaringan', 'bagus', 'tpi', 'lemot', 'pokoknya', 'buruk', 'klo', 'diperbaiki', 'ku', 'kasih', 'bintang', 'deh']","[('diliat', 'aplikasinya'), ('aplikasinya', 'menarik'), ('menarik', 'tpi'), ('tpi', 'dalamnya'), ('dalamnya', 'buruk'), ('buruk', 'klo'), ('klo', 'kasih'), ('kasih', 'alamat'), ('alamat', 'ribet'), ('ribet', 'klo'), ('klo', 'masuk'), ('masuk', 'keranjang'), ('keranjang', 'tpi'), ('tpi', 'tdk'), ('tdk', 'dibeli'), ('dibeli', 'gk'), ('gk', 'dihapus'), ('dihapus', 'pesanannya'), ('pesanannya', 'jaringan'), ('jaringan', 'bagus'), ('bagus', 'tpi'), ('tpi', 'lemot'), ('lemot', 'pokoknya'), ('pokoknya', 'buruk'), ('buruk', 'klo'), ('klo', 'diperbaiki'), ('diperbaiki', 'ku'), ('ku', 'kasih'), ('kasih', 'bintang'), ('bintang', 'deh')]",-1
201,7ac59e4a-b2c6-4b3a-80df-dbc7a1476ad9,"Apaan sih ini gopay, top up gak masuk masuk sedangkan saldo di bank sudah berkurang..orang buruburu pembayaran di telpon malah tanggapannya malah nunggu 2 hari. Lo tanggung jwab emangnya denda pembayaran saya?? Sumpah jadi trauma top up untuk pembayaran via gopay ğŸ˜¡ğŸ˜¡ğŸ˜¡","['sih', 'gopay', 'top', 'up', 'gak', 'masuk', 'masuk', 'saldo', 'bank', 'berkurang', 'orang', 'buruburu', 'pembayaran', 'telpon', 'tanggapannya', 'nunggu', 'lo', 'tanggung', 'jwab', 'emangnya', 'denda', 'pembayaran', 'sumpah', 'trauma', 'top', 'up', 'pembayaran', 'via', 'gopay']","[('sih', 'gopay'), ('gopay', 'top'), ('top', 'up'), ('up', 'gak'), ('gak', 'masuk'), ('masuk', 'masuk'), ('masuk', 'saldo'), ('saldo', 'bank'), ('bank', 'berkurang'), ('berkurang', 'orang'), ('orang', 'buruburu'), ('buruburu', 'pembayaran'), ('pembayaran', 'telpon'), ('telpon', 'tanggapannya'), ('tanggapannya', 'nunggu'), ('nunggu', 'lo'), ('lo', 'tanggung'), ('tanggung', 'jwab'), ('jwab', 'emangnya'), ('emangnya', 'denda'), ('denda', 'pembayaran'), ('pembayaran', 'sumpah'), ('sumpah', 'trauma'), ('trauma', 'top'), ('top', 'up'), ('up', 'pembayaran'), ('pembayaran', 'via'), ('via', 'gopay')]",-1
202,55d282e1-d812-480d-8565-d9259e40753b,"Jujur kecewa krn tidak bisa nggabungin lagi voucher toko dan gofood dlm 1x transaksi. Sebenernya heran krn voucher dari toko adl hak kita sbg pembeli, dan voucher dari gojek (jika ada) adl hak kita sbg pengguna. Entah pola pikir macam apa yg bikin Gojek mikir hanya bisa pilih satu voucher. Penambahan jasa aplikasi jga sudah aneh (krn dari awal biaya jasa harusnya sudah terhitung dlm transaksi), sekarang tambah lagi alasan yg bakal bikin pelanggan kalian milih ap sebelah.","['jujur', 'kecewa', 'krn', 'nggabungin', 'voucher', 'toko', 'gofood', 'dlm', 'x', 'transaksi', 'sebenernya', 'heran', 'krn', 'voucher', 'toko', 'adl', 'hak', 'sbg', 'pembeli', 'voucher', 'gojek', 'adl', 'hak', 'sbg', 'pengguna', 'pola', 'pikir', 'yg', 'bikin', 'gojek', 'mikir', 'pilih', 'voucher', 'penambahan', 'jasa', 'aplikasi', 'jga', 'aneh', 'krn', 'biaya', 'jasa', 'terhitung', 'dlm', 'transaksi', 'alasan', 'yg', 'bikin', 'pelanggan', 'milih', 'ap', 'sebelah']","[('jujur', 'kecewa'), ('kecewa', 'krn'), ('krn', 'nggabungin'), ('nggabungin', 'voucher'), ('voucher', 'toko'), ('toko', 'gofood'), ('gofood', 'dlm'), ('dlm', 'x'), ('x', 'transaksi'), ('transaksi', 'sebenernya'), ('sebenernya', 'heran'), ('heran', 'krn'), ('krn', 'voucher'), ('voucher', 'toko'), ('toko', 'adl'), ('adl', 'hak'), ('hak', 'sbg'), ('sbg', 'pembeli'), ('pembeli', 'voucher'), ('voucher', 'gojek'), ('gojek', 'adl'), ('adl', 'hak'), ('hak', 'sbg'), ('sbg', 'pengguna'), ('pengguna', 'pola'), ('pola', 'pikir'), ('pikir', 'yg'), ('yg', 'bikin'), ('bikin', 'gojek'), ('gojek', 'mikir'), ('mikir', 'pilih'), ('pilih', 'voucher'), ('voucher', 'penambahan'), ('penambahan', 'jasa'), ('jasa', 'aplikasi'), ('aplikasi', 'jga'), ('jga', 'aneh'), ('aneh', 'krn'), ('krn', 'biaya'), ('biaya', 'jasa'), ('jasa', 'terhitung'), ('terhitung', 'dlm'), ('dlm', 'transaksi'), ('transaksi', 'alasan'), ('alasan', 'yg'), ('yg', 'bikin'), ('bikin', 'pelanggan'), ('pelanggan', 'milih'), ('milih', 'ap'), ('ap', 'sebelah')]",-1
203,e6afcc49-9477-4241-b4ef-c293cf2b321e,Heran sama Gojek. Padahal untuk Paylater nya gak pernah telat bayar tapi kenapa selalu muncul ada tagihan. Setelah di cek gak ada tagihan. Tapi pesannya muncul terus. Lama lama Paylater nya di blokir tanpa ada sebab,"['heran', 'gojek', 'paylater', 'nya', 'gak', 'telat', 'bayar', 'muncul', 'tagihan', 'cek', 'gak', 'tagihan', 'pesannya', 'muncul', 'paylater', 'nya', 'blokir']","[('heran', 'gojek'), ('gojek', 'paylater'), ('paylater', 'nya'), ('nya', 'gak'), ('gak', 'telat'), ('telat', 'bayar'), ('bayar', 'muncul'), ('muncul', 'tagihan'), ('tagihan', 'cek'), ('cek', 'gak'), ('gak', 'tagihan'), ('tagihan', 'pesannya'), ('pesannya', 'muncul'), ('muncul', 'paylater'), ('paylater', 'nya'), ('nya', 'blokir')]",-1
204,5f2e68e6-cc6e-4c9e-a303-e917f1db8d9c,"Aplikasi tidak ada fitur complain, ada fitur bantuan tapi gak ada yg merespon di fitur ini, sy pesan gocar tidak masuk parkiran tapi dikenakan ongkos parkir dan nilainya cukup lumayan 10k untuk biaya parkir padahal umumnya tarif parkir hanya 5k, sdh masuk fitur bantuan tapi sudah seharian tidak ada yg merespon atau membalas chat sy, entah harus menanyakan kemana, tolong diperbaiki aplikasinya","['aplikasi', 'fitur', 'complain', 'fitur', 'bantuan', 'gak', 'yg', 'merespon', 'fitur', 'sy', 'pesan', 'gocar', 'masuk', 'parkiran', 'dikenakan', 'ongkos', 'parkir', 'nilainya', 'lumayan', 'k', 'biaya', 'parkir', 'tarif', 'parkir', 'k', 'sdh', 'masuk', 'fitur', 'bantuan', 'seharian', 'yg', 'merespon', 'membalas', 'chat', 'sy', 'kemana', 'tolong', 'diperbaiki', 'aplikasinya']","[('aplikasi', 'fitur'), ('fitur', 'complain'), ('complain', 'fitur'), ('fitur', 'bantuan'), ('bantuan', 'gak'), ('gak', 'yg'), ('yg', 'merespon'), ('merespon', 'fitur'), ('fitur', 'sy'), ('sy', 'pesan'), ('pesan', 'gocar'), ('gocar', 'masuk'), ('masuk', 'parkiran'), ('parkiran', 'dikenakan'), ('dikenakan', 'ongkos'), ('ongkos', 'parkir'), ('parkir', 'nilainya'), ('nilainya', 'lumayan'), ('lumayan', 'k'), ('k', 'biaya'), ('biaya', 'parkir'), ('parkir', 'tarif'), ('tarif', 'parkir'), ('parkir', 'k'), ('k', 'sdh'), ('sdh', 'masuk'), ('masuk', 'fitur'), ('fitur', 'bantuan'), ('bantuan', 'seharian'), ('seharian', 'yg'), ('yg', 'merespon'), ('merespon', 'membalas'), ('membalas', 'chat'), ('chat', 'sy'), ('sy', 'kemana'), ('kemana', 'tolong'), ('tolong', 'diperbaiki'), ('diperbaiki', 'aplikasinya')]",-1
205,2dcfe047-0ab5-4ae6-ad74-19a29543ddee,"Gua gatau ini masalahnya dimana Tapi mau pesen gofood bener"" lelet banget ngebug ngelag. Pake aplikasi lain, sinyal nya bagus lancar, tiba di sini bisa menua nungguin loading","['gua', 'gatau', 'dimana', 'pesen', 'gofood', 'bener', 'lelet', 'banget', 'ngebug', 'ngelag', 'pake', 'aplikasi', 'sinyal', 'nya', 'bagus', 'lancar', 'menua', 'nungguin', 'loading']","[('gua', 'gatau'), ('gatau', 'dimana'), ('dimana', 'pesen'), ('pesen', 'gofood'), ('gofood', 'bener'), ('bener', 'lelet'), ('lelet', 'banget'), ('banget', 'ngebug'), ('ngebug', 'ngelag'), ('ngelag', 'pake'), ('pake', 'aplikasi'), ('aplikasi', 'sinyal'), ('sinyal', 'nya'), ('nya', 'bagus'), ('bagus', 'lancar'), ('lancar', 'menua'), ('menua', 'nungguin'), ('nungguin', 'loading')]",-1
206,99300600-63f3-434a-91b6-a7fd94518d53,"saya belanja di alfamart,dan mau bayar pakai gopay,tapi gabisa bisa,karena kode dah hangus,terus disuruh minta kode baru,tetep aja ga bisa2,terus sy ulang,tetap ga bisa2,sampe ga enak sama kasirnya sampe nungguin akhirnya bayar tunai dan gopaynya ga terpakai,saya jadi kecewa berat,jadi males pakai gopay klo belanja di alfamart lg.kecewa kecewa berat.mending uninstal aja klo begini,krn bukn kali ini aja sy alami,kn jadi malu","['belanja', 'alfamart', 'bayar', 'pakai', 'gopay', 'gabisa', 'kode', 'dah', 'hangus', 'disuruh', 'kode', 'tetep', 'aja', 'ga', 'sy', 'ulang', 'ga', 'sampe', 'ga', 'enak', 'kasirnya', 'sampe', 'nungguin', 'bayar', 'tunai', 'gopaynya', 'ga', 'terpakai', 'kecewa', 'berat', 'males', 'pakai', 'gopay', 'klo', 'belanja', 'alfamart', 'lg', 'kecewa', 'kecewa', 'berat', 'mending', 'uninstal', 'aja', 'klo', 'krn', 'bukn', 'kali', 'aja', 'sy', 'alami', 'kn', 'malu']","[('belanja', 'alfamart'), ('alfamart', 'bayar'), ('bayar', 'pakai'), ('pakai', 'gopay'), ('gopay', 'gabisa'), ('gabisa', 'kode'), ('kode', 'dah'), ('dah', 'hangus'), ('hangus', 'disuruh'), ('disuruh', 'kode'), ('kode', 'tetep'), ('tetep', 'aja'), ('aja', 'ga'), ('ga', 'sy'), ('sy', 'ulang'), ('ulang', 'ga'), ('ga', 'sampe'), ('sampe', 'ga'), ('ga', 'enak'), ('enak', 'kasirnya'), ('kasirnya', 'sampe'), ('sampe', 'nungguin'), ('nungguin', 'bayar'), ('bayar', 'tunai'), ('tunai', 'gopaynya'), ('gopaynya', 'ga'), ('ga', 'terpakai'), ('terpakai', 'kecewa'), ('kecewa', 'berat'), ('berat', 'males'), ('males', 'pakai'), ('pakai', 'gopay'), ('gopay', 'klo'), ('klo', 'belanja'), ('belanja', 'alfamart'), ('alfamart', 'lg'), ('lg', 'kecewa'), ('kecewa', 'kecewa'), ('kecewa', 'berat'), ('berat', 'mending'), ('mending', 'uninstal'), ('uninstal', 'aja'), ('aja', 'klo'), ('klo', 'krn'), ('krn', 'bukn'), ('bukn', 'kali'), ('kali', 'aja'), ('aja', 'sy'), ('sy', 'alami'), ('alami', 'kn'), ('kn', 'malu')]",-1
207,e27bddd7-20e6-4983-8657-9fcba2d1c09f,"Padahal sangat sering pakaii, ketika disambungkan ke tokped buat pembayaran via gopay malah pin salah truss. Pdhl gapernah ganti pin. Sampai klik lupa pin berkali2 malah ga dapat kode otp. Sampai di reinstall ehh malah gabisa login kode otp juga ga dikirim-kirim. Gimana sihhh bikin emosii ajaa","['pakaii', 'disambungkan', 'tokped', 'pembayaran', 'via', 'gopay', 'pin', 'salah', 'truss', 'pdhl', 'gapernah', 'ganti', 'pin', 'klik', 'lupa', 'pin', 'berkali', 'ga', 'kode', 'otp', 'reinstall', 'ehh', 'gabisa', 'login', 'kode', 'otp', 'ga', 'dikirim', 'kirim', 'gimana', 'sihhh', 'bikin', 'emosii', 'ajaa']","[('pakaii', 'disambungkan'), ('disambungkan', 'tokped'), ('tokped', 'pembayaran'), ('pembayaran', 'via'), ('via', 'gopay'), ('gopay', 'pin'), ('pin', 'salah'), ('salah', 'truss'), ('truss', 'pdhl'), ('pdhl', 'gapernah'), ('gapernah', 'ganti'), ('ganti', 'pin'), ('pin', 'klik'), ('klik', 'lupa'), ('lupa', 'pin'), ('pin', 'berkali'), ('berkali', 'ga'), ('ga', 'kode'), ('kode', 'otp'), ('otp', 'reinstall'), ('reinstall', 'ehh'), ('ehh', 'gabisa'), ('gabisa', 'login'), ('login', 'kode'), ('kode', 'otp'), ('otp', 'ga'), ('ga', 'dikirim'), ('dikirim', 'kirim'), ('kirim', 'gimana'), ('gimana', 'sihhh'), ('sihhh', 'bikin'), ('bikin', 'emosii'), ('emosii', 'ajaa')]",-1
208,17fb5a15-a9f6-4182-876b-b51436dc669e,"Voucher harta Karun gofood makin kesini kok makin ""receh"". Yg namanya harta Karun ya harusnya worth it, kok ini cuma ngasih diskon kecil banget dengan syarat pembelian gede banget. Padahal sudah level juragan karena sering pakai aplikasi, tapi kok sama langganan lama malah dikasih voucher kecil2 melulu, gak kayak awal2 dulu. Mana ongkir naik, biaya layanan naik, tapi ke pelanggan ga ngasih iming2 apa2. Bisa2 pada ga mau pake app lagi kalo begini.","['voucher', 'harta', 'karun', 'gofood', 'kesini', 'receh', 'yg', 'namanya', 'harta', 'karun', 'ya', 'worth', 'it', 'ngasih', 'diskon', 'banget', 'syarat', 'pembelian', 'gede', 'banget', 'level', 'juragan', 'pakai', 'aplikasi', 'langganan', 'dikasih', 'voucher', 'melulu', 'gak', 'kayak', 'ongkir', 'biaya', 'layanan', 'pelanggan', 'ga', 'ngasih', 'iming', 'ga', 'pake', 'app', 'kalo']","[('voucher', 'harta'), ('harta', 'karun'), ('karun', 'gofood'), ('gofood', 'kesini'), ('kesini', 'receh'), ('receh', 'yg'), ('yg', 'namanya'), ('namanya', 'harta'), ('harta', 'karun'), ('karun', 'ya'), ('ya', 'worth'), ('worth', 'it'), ('it', 'ngasih'), ('ngasih', 'diskon'), ('diskon', 'banget'), ('banget', 'syarat'), ('syarat', 'pembelian'), ('pembelian', 'gede'), ('gede', 'banget'), ('banget', 'level'), ('level', 'juragan'), ('juragan', 'pakai'), ('pakai', 'aplikasi'), ('aplikasi', 'langganan'), ('langganan', 'dikasih'), ('dikasih', 'voucher'), ('voucher', 'melulu'), ('melulu', 'gak'), ('gak', 'kayak'), ('kayak', 'ongkir'), ('ongkir', 'biaya'), ('biaya', 'layanan'), ('layanan', 'pelanggan'), ('pelanggan', 'ga'), ('ga', 'ngasih'), ('ngasih', 'iming'), ('iming', 'ga'), ('ga', 'pake'), ('pake', 'app'), ('app', 'kalo')]",-1
209,09528cd8-0898-4b63-9557-4b21b75483b7,"Susah masuk pas baru ngisi saldo GO-PAY, padahal mau beli makan. Mesti masukin PIN dulu dan konfirmasi pake kode OTP. Padahal kan aku login ke akun gojek yang kartunya udah ilangğŸ˜­ padahal bisa aja ngirim kode Verifikasi ke email dll, tapi ini cuma bisa via SMS doang kode OTP nya.. Ah lemah gojek mah, kalah sama aplikasi tetanggağŸ˜ª","['susah', 'masuk', 'pas', 'ngisi', 'saldo', 'go', 'pay', 'beli', 'makan', 'mesti', 'masukin', 'pin', 'konfirmasi', 'pake', 'kode', 'otp', 'login', 'akun', 'gojek', 'kartunya', 'udah', 'ilang', 'aja', 'ngirim', 'kode', 'verifikasi', 'email', 'dll', 'via', 'sms', 'doang', 'kode', 'otp', 'nya', 'ah', 'lemah', 'gojek', 'mah', 'kalah', 'aplikasi', 'tetangga']","[('susah', 'masuk'), ('masuk', 'pas'), ('pas', 'ngisi'), ('ngisi', 'saldo'), ('saldo', 'go'), ('go', 'pay'), ('pay', 'beli'), ('beli', 'makan'), ('makan', 'mesti'), ('mesti', 'masukin'), ('masukin', 'pin'), ('pin', 'konfirmasi'), ('konfirmasi', 'pake'), ('pake', 'kode'), ('kode', 'otp'), ('otp', 'login'), ('login', 'akun'), ('akun', 'gojek'), ('gojek', 'kartunya'), ('kartunya', 'udah'), ('udah', 'ilang'), ('ilang', 'aja'), ('aja', 'ngirim'), ('ngirim', 'kode'), ('kode', 'verifikasi'), ('verifikasi', 'email'), ('email', 'dll'), ('dll', 'via'), ('via', 'sms'), ('sms', 'doang'), ('doang', 'kode'), ('kode', 'otp'), ('otp', 'nya'), ('nya', 'ah'), ('ah', 'lemah'), ('lemah', 'gojek'), ('gojek', 'mah'), ('mah', 'kalah'), ('kalah', 'aplikasi'), ('aplikasi', 'tetangga')]",-1
210,e7a731d7-3dea-4f11-9e0a-213e009630e8,"Biasa nya dr titik jemput ke lokasi 19 - 22 rb an skrng jadi 36-40 rb an karna di ambil rute terjauh pdhal sblm nya di ambil rute terdekat , jadi ga worthit banget bayar sgtu tp sbner nya jarak yg di tempuh ga sgtu jauh nya . Mau ambil untung banyak ya kayak nya.","['nya', 'dr', 'titik', 'jemput', 'lokasi', 'rb', 'an', 'skrng', 'rb', 'an', 'karna', 'ambil', 'rute', 'terjauh', 'pdhal', 'sblm', 'nya', 'ambil', 'rute', 'terdekat', 'ga', 'worthit', 'banget', 'bayar', 'sgtu', 'tp', 'sbner', 'nya', 'jarak', 'yg', 'tempuh', 'ga', 'sgtu', 'nya', 'ambil', 'untung', 'ya', 'kayak', 'nya']","[('nya', 'dr'), ('dr', 'titik'), ('titik', 'jemput'), ('jemput', 'lokasi'), ('lokasi', 'rb'), ('rb', 'an'), ('an', 'skrng'), ('skrng', 'rb'), ('rb', 'an'), ('an', 'karna'), ('karna', 'ambil'), ('ambil', 'rute'), ('rute', 'terjauh'), ('terjauh', 'pdhal'), ('pdhal', 'sblm'), ('sblm', 'nya'), ('nya', 'ambil'), ('ambil', 'rute'), ('rute', 'terdekat'), ('terdekat', 'ga'), ('ga', 'worthit'), ('worthit', 'banget'), ('banget', 'bayar'), ('bayar', 'sgtu'), ('sgtu', 'tp'), ('tp', 'sbner'), ('sbner', 'nya'), ('nya', 'jarak'), ('jarak', 'yg'), ('yg', 'tempuh'), ('tempuh', 'ga'), ('ga', 'sgtu'), ('sgtu', 'nya'), ('nya', 'ambil'), ('ambil', 'untung'), ('untung', 'ya'), ('ya', 'kayak'), ('kayak', 'nya')]",-1
211,b6bbb9b9-8d93-43ad-a5d7-dad19cfba0fc,"Dari dulu mau log in susah amat.. tdk semua orang nomernya masih tetap yg dulu.. emailnya juga.. nomer inget email nya lupa,, ga bisa log in ribet amat,, udah disitu tdk ada tulisan ganti nomer ada,, susah amat,, perbaiki lah jgn dibikin ribet buat log in.. cukup log in yg simpel aja.. pake fb apa akun google.. kyk lazada sekali log in klil google.. lngsung masuk ga udah nomer2 lagi ribet,,","['log', 'in', 'susah', 'tdk', 'orang', 'nomernya', 'yg', 'emailnya', 'nomer', 'inget', 'email', 'nya', 'lupa', 'ga', 'log', 'in', 'ribet', 'udah', 'disitu', 'tdk', 'tulisan', 'ganti', 'nomer', 'susah', 'perbaiki', 'jgn', 'dibikin', 'ribet', 'log', 'in', 'log', 'in', 'yg', 'simpel', 'aja', 'pake', 'fb', 'akun', 'google', 'kyk', 'lazada', 'log', 'in', 'klil', 'google', 'lngsung', 'masuk', 'ga', 'udah', 'nomer', 'ribet']","[('log', 'in'), ('in', 'susah'), ('susah', 'tdk'), ('tdk', 'orang'), ('orang', 'nomernya'), ('nomernya', 'yg'), ('yg', 'emailnya'), ('emailnya', 'nomer'), ('nomer', 'inget'), ('inget', 'email'), ('email', 'nya'), ('nya', 'lupa'), ('lupa', 'ga'), ('ga', 'log'), ('log', 'in'), ('in', 'ribet'), ('ribet', 'udah'), ('udah', 'disitu'), ('disitu', 'tdk'), ('tdk', 'tulisan'), ('tulisan', 'ganti'), ('ganti', 'nomer'), ('nomer', 'susah'), ('susah', 'perbaiki'), ('perbaiki', 'jgn'), ('jgn', 'dibikin'), ('dibikin', 'ribet'), ('ribet', 'log'), ('log', 'in'), ('in', 'log'), ('log', 'in'), ('in', 'yg'), ('yg', 'simpel'), ('simpel', 'aja'), ('aja', 'pake'), ('pake', 'fb'), ('fb', 'akun'), ('akun', 'google'), ('google', 'kyk'), ('kyk', 'lazada'), ('lazada', 'log'), ('log', 'in'), ('in', 'klil'), ('klil', 'google'), ('google', 'lngsung'), ('lngsung', 'masuk'), ('masuk', 'ga'), ('ga', 'udah'), ('udah', 'nomer'), ('nomer', 'ribet')]",-1
212,0970130d-81d9-4c5b-b509-d6284c66e20a,"Fitur gopay plus sangat susah sekali mau verifikasi identitas aja di persulit minta ampun, udah beberapa kali saya coba selalu gagal. Gak kaya aplikasi lain yang sekali daftar langsung ACC","['fitur', 'gopay', 'plus', 'susah', 'verifikasi', 'identitas', 'aja', 'persulit', 'ampun', 'udah', 'kali', 'coba', 'gagal', 'gak', 'kaya', 'aplikasi', 'daftar', 'langsung', 'acc']","[('fitur', 'gopay'), ('gopay', 'plus'), ('plus', 'susah'), ('susah', 'verifikasi'), ('verifikasi', 'identitas'), ('identitas', 'aja'), ('aja', 'persulit'), ('persulit', 'ampun'), ('ampun', 'udah'), ('udah', 'kali'), ('kali', 'coba'), ('coba', 'gagal'), ('gagal', 'gak'), ('gak', 'kaya'), ('kaya', 'aplikasi'), ('aplikasi', 'daftar'), ('daftar', 'langsung'), ('langsung', 'acc')]",-1
