no,id,text,token_1,token_2,polarity
629,c9d47d55-ad7e-441a-b5e6-ac917623050f,"Hi gojek, klo biasa voucher gofood bisa 2 dong di pake.karena sejak vc go food cuma satu yg bisa dipakai,aku gapernah order gofood lagi.trims","['hi', 'gojek', 'klo', 'voucher', 'gofood', 'pake', 'vc', 'go', 'food', 'yg', 'dipakai', 'gapernah', 'order', 'gofood', 'trims']","[('hi', 'gojek'), ('gojek', 'klo'), ('klo', 'voucher'), ('voucher', 'gofood'), ('gofood', 'pake'), ('pake', 'vc'), ('vc', 'go'), ('go', 'food'), ('food', 'yg'), ('yg', 'dipakai'), ('dipakai', 'gapernah'), ('gapernah', 'order'), ('order', 'gofood'), ('gofood', 'trims')]",1
630,0168e187-a3e9-4c8d-b19d-9acff68506f0,"Selama pake ini gak ada kendala kecuali gak ada paketan aja , sama suka gak ada jaringan","['pake', 'gak', 'kendala', 'kecuali', 'gak', 'paketan', 'aja', 'suka', 'gak', 'jaringan']","[('pake', 'gak'), ('gak', 'kendala'), ('kendala', 'kecuali'), ('kecuali', 'gak'), ('gak', 'paketan'), ('paketan', 'aja'), ('aja', 'suka'), ('suka', 'gak'), ('gak', 'jaringan')]",1
631,bcdfbaf0-c0a2-46cd-9410-f078ce1a6f12,Sangat membatu sekali kalau akan berpegian tinggal pesan tunggu sebentar driver sudah tiba,"['membatu', 'berpegian', 'tinggal', 'pesan', 'tunggu', 'sebentar', 'driver']","[('membatu', 'berpegian'), ('berpegian', 'tinggal'), ('tinggal', 'pesan'), ('pesan', 'tunggu'), ('tunggu', 'sebentar'), ('sebentar', 'driver')]",1
632,7a44cd46-7fde-4d7c-b89a-624b382f45af,Memudahkan semua perjalanan dan memudahkan solusi mencari makanan ğŸ˜,"['memudahkan', 'perjalanan', 'memudahkan', 'solusi', 'mencari', 'makanan']","[('memudahkan', 'perjalanan'), ('perjalanan', 'memudahkan'), ('memudahkan', 'solusi'), ('solusi', 'mencari'), ('mencari', 'makanan')]",1
633,299d13b4-44d5-4284-bb38-855f1999eb60,"Muantaapp pisan gojek mah lah, titik peta nya pas, ga kaya aplikasi sebelah pusing sy nentuin titik map nya.","['muantaapp', 'pisan', 'gojek', 'mah', 'titik', 'peta', 'nya', 'pas', 'ga', 'kaya', 'aplikasi', 'sebelah', 'pusing', 'sy', 'nentuin', 'titik', 'map', 'nya']","[('muantaapp', 'pisan'), ('pisan', 'gojek'), ('gojek', 'mah'), ('mah', 'titik'), ('titik', 'peta'), ('peta', 'nya'), ('nya', 'pas'), ('pas', 'ga'), ('ga', 'kaya'), ('kaya', 'aplikasi'), ('aplikasi', 'sebelah'), ('sebelah', 'pusing'), ('pusing', 'sy'), ('sy', 'nentuin'), ('nentuin', 'titik'), ('titik', 'map'), ('map', 'nya')]",1
634,f2a55892-9934-479f-9df2-0b6633307a8a,perjalanan lebih aman dan nyaman apalagi perginya ngajak anak ma lansia,"['perjalanan', 'aman', 'nyaman', 'perginya', 'ngajak', 'anak', 'ma', 'lansia']","[('perjalanan', 'aman'), ('aman', 'nyaman'), ('nyaman', 'perginya'), ('perginya', 'ngajak'), ('ngajak', 'anak'), ('anak', 'ma'), ('ma', 'lansia')]",1
635,c0379dc7-1f61-49c3-b10e-f3d1b37c0c8d,Aplikasi gojek sangat mudah di gunakan dan sangat mudah dipahami dengan cepat.. Sukses selalu gojek indonesia dan driver gojek semakin jaya..Aamiin,"['aplikasi', 'gojek', 'mudah', 'mudah', 'dipahami', 'cepat', 'sukses', 'gojek', 'indonesia', 'driver', 'gojek', 'jaya', 'aamiin']","[('aplikasi', 'gojek'), ('gojek', 'mudah'), ('mudah', 'mudah'), ('mudah', 'dipahami'), ('dipahami', 'cepat'), ('cepat', 'sukses'), ('sukses', 'gojek'), ('gojek', 'indonesia'), ('indonesia', 'driver'), ('driver', 'gojek'), ('gojek', 'jaya'), ('jaya', 'aamiin')]",1
636,af8e9137-b9fc-40e3-b739-035db5989f6f,"Sangat membantu sekali,,,waktu lebih singkat ongkos lebih hematğŸ‘ğŸ‘ğŸ‘","['membantu', 'singkat', 'ongkos', 'hemat']","[('membantu', 'singkat'), ('singkat', 'ongkos'), ('ongkos', 'hemat')]",1
637,0e3a1041-c316-4755-9672-e6c7acd2aff6,"Dari dulu pake aplikasi GOJEK dan nyaman sampai sekarang, bnyak juga Promonya ğŸ˜ğŸ™‚","['pake', 'aplikasi', 'gojek', 'nyaman', 'bnyak', 'promonya']","[('pake', 'aplikasi'), ('aplikasi', 'gojek'), ('gojek', 'nyaman'), ('nyaman', 'bnyak'), ('bnyak', 'promonya')]",1
638,fcf01724-9b77-44b7-871b-74c21c5f4a34,"Service lebih baik, rejeki dijamin lancar..apalagi banyak promo","['service', 'rejeki', 'dijamin', 'lancar', 'promo']","[('service', 'rejeki'), ('rejeki', 'dijamin'), ('dijamin', 'lancar'), ('lancar', 'promo')]",1
639,48e90a76-6481-4c1e-a37e-50481d1e71ae,"Kalau bisa tampilannya dibikin lebih berkesan universal gtu, jangan yg kesannya hanya fokus ke layanan tertentu aja â˜ºï¸ğŸ™","['tampilannya', 'dibikin', 'berkesan', 'universal', 'gtu', 'yg', 'kesannya', 'fokus', 'layanan', 'aja']","[('tampilannya', 'dibikin'), ('dibikin', 'berkesan'), ('berkesan', 'universal'), ('universal', 'gtu'), ('gtu', 'yg'), ('yg', 'kesannya'), ('kesannya', 'fokus'), ('fokus', 'layanan'), ('layanan', 'aja')]",1
640,8375f256-b3df-420a-881a-0a9a25bead62,"Terim kasih aplikasi gojek ğŸ™ğŸ» semenjak ad aplikasi ini, membuat semua yg rumit menjadi mudah. Top markotop & the best ğŸ‘ğŸ»ğŸ‘ŒğŸ»","['terim', 'kasih', 'aplikasi', 'gojek', 'semenjak', 'ad', 'aplikasi', 'yg', 'rumit', 'mudah', 'top', 'markotop', 'the', 'best']","[('terim', 'kasih'), ('kasih', 'aplikasi'), ('aplikasi', 'gojek'), ('gojek', 'semenjak'), ('semenjak', 'ad'), ('ad', 'aplikasi'), ('aplikasi', 'yg'), ('yg', 'rumit'), ('rumit', 'mudah'), ('mudah', 'top'), ('top', 'markotop'), ('markotop', 'the'), ('the', 'best')]",1
641,cb3e2bc9-1728-4d66-b778-70e2d3e900fc,Banyak promonya. Kagak ribet.. Moga makin baik lagi dan ditambah promo2 yang lain..,"['promonya', 'kagak', 'ribet', 'moga', 'ditambah', 'promo']","[('promonya', 'kagak'), ('kagak', 'ribet'), ('ribet', 'moga'), ('moga', 'ditambah'), ('ditambah', 'promo')]",1
642,e27d33f9-8f12-42df-947a-7aee55da7da4,Aplikasi gojek ini benar2 mantap transaksi apapun lancar dan cepat aku kasih bintang 5,"['aplikasi', 'gojek', 'mantap', 'transaksi', 'apapun', 'lancar', 'cepat', 'kasih', 'bintang']","[('aplikasi', 'gojek'), ('gojek', 'mantap'), ('mantap', 'transaksi'), ('transaksi', 'apapun'), ('apapun', 'lancar'), ('lancar', 'cepat'), ('cepat', 'kasih'), ('kasih', 'bintang')]",1
643,d5be04f1-424f-4d3a-879e-60f5cc5f2e58,Pelayanan sangat bagus sekali dan ramah kalau bisa di tingkatkan terus,"['pelayanan', 'bagus', 'ramah', 'tingkatkan']","[('pelayanan', 'bagus'), ('bagus', 'ramah'), ('ramah', 'tingkatkan')]",1
644,a4b2c92f-52b0-42e2-904a-f60e08f1b02d,Kadang bingung gak bisa di suruh belanja diwarung biasağŸ˜,"['kadang', 'bingung', 'gak', 'suruh', 'belanja', 'diwarung']","[('kadang', 'bingung'), ('bingung', 'gak'), ('gak', 'suruh'), ('suruh', 'belanja'), ('belanja', 'diwarung')]",1
645,5dd12caf-141a-4148-84ef-b1ab4a23855a,Alhamdulillah aplikasi GO-JEK sudah terhubung kembali dengan aplikasi pembayaran Home Credit Indonesia.... Makasih GO-JEK,"['alhamdulillah', 'aplikasi', 'go', 'jek', 'terhubung', 'aplikasi', 'pembayaran', 'home', 'credit', 'indonesia', 'makasih', 'go', 'jek']","[('alhamdulillah', 'aplikasi'), ('aplikasi', 'go'), ('go', 'jek'), ('jek', 'terhubung'), ('terhubung', 'aplikasi'), ('aplikasi', 'pembayaran'), ('pembayaran', 'home'), ('home', 'credit'), ('credit', 'indonesia'), ('indonesia', 'makasih'), ('makasih', 'go'), ('go', 'jek')]",1
646,e42b56c7-9fe6-4b9a-b19f-6406acfbcb7c,"Driver lain banyak cancel, krn titik jemput jauh. Nah ini masih amanah ...","['driver', 'cancel', 'krn', 'titik', 'jemput', 'amanah']","[('driver', 'cancel'), ('cancel', 'krn'), ('krn', 'titik'), ('titik', 'jemput'), ('jemput', 'amanah')]",1
647,5d259c28-bd59-454a-9994-faa5daeb35f7,"Enak pakai,sangat mudah untuk keadaan darurat.. Tapi kenapa gopaylater tdk bisa digunakan kembali huhu sedih T_T Dan juga voucher nya gabisa pake 2 sekaligusssğŸ˜”","['enak', 'pakai', 'mudah', 'darurat', 'gopaylater', 'tdk', 'huhu', 'sedih', 't', 't', 'voucher', 'nya', 'gabisa', 'pake', 'sekaligusss']","[('enak', 'pakai'), ('pakai', 'mudah'), ('mudah', 'darurat'), ('darurat', 'gopaylater'), ('gopaylater', 'tdk'), ('tdk', 'huhu'), ('huhu', 'sedih'), ('sedih', 't'), ('t', 't'), ('t', 'voucher'), ('voucher', 'nya'), ('nya', 'gabisa'), ('gabisa', 'pake'), ('pake', 'sekaligusss')]",1
648,ceaef9f1-67ef-45e0-8207-7ae15fc8ff9e,Sangat bagus.dari sini kita bisa menghemat pengeluaran melalui Aplikasi ini.sy sudah membuktikannya.,"['bagus', 'menghemat', 'pengeluaran', 'aplikasi', 'sy', 'membuktikannya']","[('bagus', 'menghemat'), ('menghemat', 'pengeluaran'), ('pengeluaran', 'aplikasi'), ('aplikasi', 'sy'), ('sy', 'membuktikannya')]",1
649,9e05b610-e6e6-4cfb-9e6a-00034c63e73c,Fitur nya sih ok ok aja tapi kenapa ya saya mau daftar gopaylater selalu di tolak padahal saya sering banget bayar pake gojek ...akun saya juga udah akun juragan tapi kenapa di tolak terus.sedangakn saya liat temen temen saya yang baru pake gojek daftar gopaylater langsung d terima..parah nih masa yng baru daftar d terima sedangkan pengguna setia malah di tolak ...mohon dong di bantu,"['fitur', 'nya', 'sih', 'ok', 'ok', 'aja', 'ya', 'daftar', 'gopaylater', 'tolak', 'banget', 'bayar', 'pake', 'gojek', 'akun', 'udah', 'akun', 'juragan', 'tolak', 'sedangakn', 'liat', 'temen', 'temen', 'pake', 'gojek', 'daftar', 'gopaylater', 'langsung', 'd', 'terima', 'parah', 'nih', 'yng', 'daftar', 'd', 'terima', 'pengguna', 'setia', 'tolak', 'mohon', 'bantu']","[('fitur', 'nya'), ('nya', 'sih'), ('sih', 'ok'), ('ok', 'ok'), ('ok', 'aja'), ('aja', 'ya'), ('ya', 'daftar'), ('daftar', 'gopaylater'), ('gopaylater', 'tolak'), ('tolak', 'banget'), ('banget', 'bayar'), ('bayar', 'pake'), ('pake', 'gojek'), ('gojek', 'akun'), ('akun', 'udah'), ('udah', 'akun'), ('akun', 'juragan'), ('juragan', 'tolak'), ('tolak', 'sedangakn'), ('sedangakn', 'liat'), ('liat', 'temen'), ('temen', 'temen'), ('temen', 'pake'), ('pake', 'gojek'), ('gojek', 'daftar'), ('daftar', 'gopaylater'), ('gopaylater', 'langsung'), ('langsung', 'd'), ('d', 'terima'), ('terima', 'parah'), ('parah', 'nih'), ('nih', 'yng'), ('yng', 'daftar'), ('daftar', 'd'), ('d', 'terima'), ('terima', 'pengguna'), ('pengguna', 'setia'), ('setia', 'tolak'), ('tolak', 'mohon'), ('mohon', 'bantu')]",1
650,f15e4b47-be67-4401-b642-36cc227c3a19,"Gimana si ini erorr saya mesen sekali orderan lg dijalan malah ada yg ke orderr lg ,uda pake vocer pas turun malah tetep ke harga awal mana nyebelin bgt itu kaga ramah saya masih berbaik.hati kasih bintang masih baguss males saya naek gojek lg maaf ya uninstal","['gimana', 'si', 'erorr', 'mesen', 'orderan', 'lg', 'dijalan', 'yg', 'orderr', 'lg', 'uda', 'pake', 'vocer', 'pas', 'turun', 'tetep', 'harga', 'nyebelin', 'bgt', 'kaga', 'ramah', 'berbaik', 'hati', 'kasih', 'bintang', 'baguss', 'males', 'naek', 'gojek', 'lg', 'maaf', 'ya', 'uninstal']","[('gimana', 'si'), ('si', 'erorr'), ('erorr', 'mesen'), ('mesen', 'orderan'), ('orderan', 'lg'), ('lg', 'dijalan'), ('dijalan', 'yg'), ('yg', 'orderr'), ('orderr', 'lg'), ('lg', 'uda'), ('uda', 'pake'), ('pake', 'vocer'), ('vocer', 'pas'), ('pas', 'turun'), ('turun', 'tetep'), ('tetep', 'harga'), ('harga', 'nyebelin'), ('nyebelin', 'bgt'), ('bgt', 'kaga'), ('kaga', 'ramah'), ('ramah', 'berbaik'), ('berbaik', 'hati'), ('hati', 'kasih'), ('kasih', 'bintang'), ('bintang', 'baguss'), ('baguss', 'males'), ('males', 'naek'), ('naek', 'gojek'), ('gojek', 'lg'), ('lg', 'maaf'), ('maaf', 'ya'), ('ya', 'uninstal')]",1
651,1e1bc1b3-a94e-456d-9ca2-a21806204d54,aplikasi ini sangat bagus dan sangat membantu sekali untuk segala keperluan kita. terima kasih gojek.,"['aplikasi', 'bagus', 'membantu', 'keperluan', 'terima', 'kasih', 'gojek']","[('aplikasi', 'bagus'), ('bagus', 'membantu'), ('membantu', 'keperluan'), ('keperluan', 'terima'), ('terima', 'kasih'), ('kasih', 'gojek')]",1
652,22652feb-62cb-44bd-a4fb-2ad6306617da,"Goride banyakin promo nya jek.. Biar para driver nya senang, banyak yg order.","['goride', 'banyakin', 'promo', 'nya', 'jek', 'biar', 'driver', 'nya', 'senang', 'yg', 'order']","[('goride', 'banyakin'), ('banyakin', 'promo'), ('promo', 'nya'), ('nya', 'jek'), ('jek', 'biar'), ('biar', 'driver'), ('driver', 'nya'), ('nya', 'senang'), ('senang', 'yg'), ('yg', 'order')]",1
653,8617e943-2cca-4bd5-866d-5a73c325445b,Jangan mahal2 kasih tarif gorude & gocar. Kok makin hari makin naik aja. Cuma itu aja keluhan sy rasakan. Selain itu puas apalagi klu ada kendala CS/bantuan nya cepat di respon.,"['mahal', 'kasih', 'tarif', 'gorude', 'gocar', 'aja', 'aja', 'keluhan', 'sy', 'rasakan', 'puas', 'klu', 'kendala', 'cs', 'bantuan', 'nya', 'cepat', 'respon']","[('mahal', 'kasih'), ('kasih', 'tarif'), ('tarif', 'gorude'), ('gorude', 'gocar'), ('gocar', 'aja'), ('aja', 'aja'), ('aja', 'keluhan'), ('keluhan', 'sy'), ('sy', 'rasakan'), ('rasakan', 'puas'), ('puas', 'klu'), ('klu', 'kendala'), ('kendala', 'cs'), ('cs', 'bantuan'), ('bantuan', 'nya'), ('nya', 'cepat'), ('cepat', 'respon')]",1
654,83ad623e-0894-4a93-ae72-36c845affd0c,"Aku sebagai pengguna selama ini, smua pengemudi gojek selalu memiliki sikap yg baik. Dan aplikasi ini juga membantu di saat2 keadaan yg membutuhkan.","['pengguna', 'smua', 'pengemudi', 'gojek', 'memiliki', 'sikap', 'yg', 'aplikasi', 'membantu', 'yg', 'membutuhkan']","[('pengguna', 'smua'), ('smua', 'pengemudi'), ('pengemudi', 'gojek'), ('gojek', 'memiliki'), ('memiliki', 'sikap'), ('sikap', 'yg'), ('yg', 'aplikasi'), ('aplikasi', 'membantu'), ('membantu', 'yg'), ('yg', 'membutuhkan')]",1
655,9abf4a6b-d825-44f6-aae2-da76a0a5c2f2,Sangat terbantu.....cepat jemput nya....sopir nya ramah.....,"['terbantu', 'cepat', 'jemput', 'nya', 'sopir', 'nya', 'ramah']","[('terbantu', 'cepat'), ('cepat', 'jemput'), ('jemput', 'nya'), ('nya', 'sopir'), ('sopir', 'nya'), ('nya', 'ramah')]",1
656,3c68f9ff-6e97-447a-a83f-695621e1bf26,"Sangat terbantu di saat kita membutuhkan pembelian baik makan, minuman maupun barang, dan lebih cepat, mudah, tidak ribet serta efisien","['terbantu', 'membutuhkan', 'pembelian', 'makan', 'minuman', 'barang', 'cepat', 'mudah', 'ribet', 'efisien']","[('terbantu', 'membutuhkan'), ('membutuhkan', 'pembelian'), ('pembelian', 'makan'), ('makan', 'minuman'), ('minuman', 'barang'), ('barang', 'cepat'), ('cepat', 'mudah'), ('mudah', 'ribet'), ('ribet', 'efisien')]",1
657,0f6a794a-471e-4a21-a67d-9f4313a071b4,cukup sangat memuaskan memakai app ini mohon ditingkatkan lagi pelayanannya makasih....!!,"['memuaskan', 'memakai', 'app', 'mohon', 'ditingkatkan', 'pelayanannya', 'makasih']","[('memuaskan', 'memakai'), ('memakai', 'app'), ('app', 'mohon'), ('mohon', 'ditingkatkan'), ('ditingkatkan', 'pelayanannya'), ('pelayanannya', 'makasih')]",1
658,0a660e0a-42f6-4ff3-b0c0-1162b6710178,"Layanan yg cepat dan baik,memberi kenyamanan pada pelanggan..","['layanan', 'yg', 'cepat', 'kenyamanan', 'pelanggan']","[('layanan', 'yg'), ('yg', 'cepat'), ('cepat', 'kenyamanan'), ('kenyamanan', 'pelanggan')]",1
659,e6eb647b-3f28-4301-b5b7-d9cfa4311632,"Antara penerima dan pengirim diperjelas lagi, kadang membingungkan untuk pemula bahasa aplikasinya","['penerima', 'pengirim', 'diperjelas', 'kadang', 'membingungkan', 'pemula', 'bahasa', 'aplikasinya']","[('penerima', 'pengirim'), ('pengirim', 'diperjelas'), ('diperjelas', 'kadang'), ('kadang', 'membingungkan'), ('membingungkan', 'pemula'), ('pemula', 'bahasa'), ('bahasa', 'aplikasinya')]",1
660,70d7eea3-799e-4ca8-bb74-6923962d2221,"Aplikasi ini sungguh berguna, disaat tidak ada yang antar atau jemput gojek solusinyağŸ‘ğŸ»ğŸ˜‹","['aplikasi', 'sungguh', 'berguna', 'disaat', 'jemput', 'gojek', 'solusinya']","[('aplikasi', 'sungguh'), ('sungguh', 'berguna'), ('berguna', 'disaat'), ('disaat', 'jemput'), ('jemput', 'gojek'), ('gojek', 'solusinya')]",1
661,a88640d6-836c-47a1-abe6-470218169216,Saya merasa lbh mudah kemana aja dg goride.. dan berbelanja dg gopay sgt membantu.. terima kasih byk gopay.. semakin maju.. dan sukses,"['lbh', 'mudah', 'kemana', 'aja', 'dg', 'goride', 'berbelanja', 'dg', 'gopay', 'sgt', 'membantu', 'terima', 'kasih', 'byk', 'gopay', 'maju', 'sukses']","[('lbh', 'mudah'), ('mudah', 'kemana'), ('kemana', 'aja'), ('aja', 'dg'), ('dg', 'goride'), ('goride', 'berbelanja'), ('berbelanja', 'dg'), ('dg', 'gopay'), ('gopay', 'sgt'), ('sgt', 'membantu'), ('membantu', 'terima'), ('terima', 'kasih'), ('kasih', 'byk'), ('byk', 'gopay'), ('gopay', 'maju'), ('maju', 'sukses')]",1
662,86c23789-070c-4f69-9369-5cdcc3a4b6b6,sangat bermanfaat di saat butuh pelayanan cepat dan tepat,"['bermanfaat', 'butuh', 'pelayanan', 'cepat']","[('bermanfaat', 'butuh'), ('butuh', 'pelayanan'), ('pelayanan', 'cepat')]",1
663,4f27d9b3-7f91-4c0b-a5e9-b9b17061f843,"Dipake gak bisa,uninsta instal lgl berkali2 gak bisa login,gopay msh ada gmn iniğŸ˜’","['dipake', 'gak', 'uninsta', 'instal', 'lgl', 'berkali', 'gak', 'login', 'gopay', 'msh', 'gmn']","[('dipake', 'gak'), ('gak', 'uninsta'), ('uninsta', 'instal'), ('instal', 'lgl'), ('lgl', 'berkali'), ('berkali', 'gak'), ('gak', 'login'), ('login', 'gopay'), ('gopay', 'msh'), ('msh', 'gmn')]",1
664,054ce91a-bde7-46fd-b0bc-efeb3c789134,Bagus...cuman biaya penanganan kalo bisa di kurangin.,"['bagus', 'cuman', 'biaya', 'penanganan', 'kalo', 'kurangin']","[('bagus', 'cuman'), ('cuman', 'biaya'), ('biaya', 'penanganan'), ('penanganan', 'kalo'), ('kalo', 'kurangin')]",1
665,aa5cd39e-aeed-4a14-bb71-45c66314c16c,sangat membantu kami untuk memudah kan dalam kemna mana terima kasih gojek aku seneng pakai aplikasi ini mudah dan tidak ribet,"['membantu', 'memudah', 'kemna', 'terima', 'kasih', 'gojek', 'seneng', 'pakai', 'aplikasi', 'mudah', 'ribet']","[('membantu', 'memudah'), ('memudah', 'kemna'), ('kemna', 'terima'), ('terima', 'kasih'), ('kasih', 'gojek'), ('gojek', 'seneng'), ('seneng', 'pakai'), ('pakai', 'aplikasi'), ('aplikasi', 'mudah'), ('mudah', 'ribet')]",1
666,64f88ec1-f011-4587-a220-3158873d0ba2,"Terima kasih Gojek... Sangat bagus, pelayanannya ramah, cepat dan memuaskan","['terima', 'kasih', 'gojek', 'bagus', 'pelayanannya', 'ramah', 'cepat', 'memuaskan']","[('terima', 'kasih'), ('kasih', 'gojek'), ('gojek', 'bagus'), ('bagus', 'pelayanannya'), ('pelayanannya', 'ramah'), ('ramah', 'cepat'), ('cepat', 'memuaskan')]",1
667,91e99f24-f5c4-41b3-a54d-9ec914338520,"Hallo gojek Aku ga tau kenapa akunya sekarang ga bisa ""pesan antar"" padahal lagi butuh banget Mungkin adminnya bisa memperbaiki atau ada informasi terkait hal ini Trims","['hallo', 'gojek', 'ga', 'tau', 'akunya', 'ga', 'pesan', 'butuh', 'banget', 'adminnya', 'memperbaiki', 'informasi', 'terkait', 'trims']","[('hallo', 'gojek'), ('gojek', 'ga'), ('ga', 'tau'), ('tau', 'akunya'), ('akunya', 'ga'), ('ga', 'pesan'), ('pesan', 'butuh'), ('butuh', 'banget'), ('banget', 'adminnya'), ('adminnya', 'memperbaiki'), ('memperbaiki', 'informasi'), ('informasi', 'terkait'), ('terkait', 'trims')]",1
668,c20ab58c-ed1c-484f-9efb-e0d6e094c913,"Bagus sih, tp kalo bisa biayanya di murahin lagi","['bagus', 'sih', 'tp', 'kalo', 'biayanya', 'murahin']","[('bagus', 'sih'), ('sih', 'tp'), ('tp', 'kalo'), ('kalo', 'biayanya'), ('biayanya', 'murahin')]",1
669,6810113f-f6b9-45d3-bc27-8ffeffd5cfce,semenjak pembaharuan sekarang setiap pesan gomart selalu ada yg kurang pesanannya terus ga bisa pilih toko masa harus ngelaporin terus kalo ada yg kurang barangnya soalnya udh 2x,"['semenjak', 'pembaharuan', 'pesan', 'gomart', 'yg', 'pesanannya', 'ga', 'pilih', 'toko', 'ngelaporin', 'kalo', 'yg', 'barangnya', 'udh', 'x']","[('semenjak', 'pembaharuan'), ('pembaharuan', 'pesan'), ('pesan', 'gomart'), ('gomart', 'yg'), ('yg', 'pesanannya'), ('pesanannya', 'ga'), ('ga', 'pilih'), ('pilih', 'toko'), ('toko', 'ngelaporin'), ('ngelaporin', 'kalo'), ('kalo', 'yg'), ('yg', 'barangnya'), ('barangnya', 'udh'), ('udh', 'x')]",1
670,d9700ff3-8e14-427e-a46f-9a531b013cd4,"Saya kasihnya bintang ğŸŒŸğŸŒŸğŸŒŸğŸŒŸğŸŒŸ karena aplikasi ini sangat membantu saya, akan tetapi baru2 ini kendalanya adalah driver awalnya yang saya dpt jaraknya dekat, akan tetapi setelah dilihat ulang driver justru menjauh dari lokasi, sehingga harus menunggu lama, apakah mengambil 2 orderan sekaligus? Yang jelas saya sangat berterimakasih dengan gojek yang punya driver ramah2.. sehat selalu semuanya ğŸ¤²","['kasihnya', 'bintang', 'aplikasi', 'membantu', 'kendalanya', 'driver', 'dpt', 'jaraknya', 'ulang', 'driver', 'menjauh', 'lokasi', 'menunggu', 'mengambil', 'orderan', 'berterimakasih', 'gojek', 'driver', 'ramah', 'sehat']","[('kasihnya', 'bintang'), ('bintang', 'aplikasi'), ('aplikasi', 'membantu'), ('membantu', 'kendalanya'), ('kendalanya', 'driver'), ('driver', 'dpt'), ('dpt', 'jaraknya'), ('jaraknya', 'ulang'), ('ulang', 'driver'), ('driver', 'menjauh'), ('menjauh', 'lokasi'), ('lokasi', 'menunggu'), ('menunggu', 'mengambil'), ('mengambil', 'orderan'), ('orderan', 'berterimakasih'), ('berterimakasih', 'gojek'), ('gojek', 'driver'), ('driver', 'ramah'), ('ramah', 'sehat')]",1
671,19769bc9-3316-4d9c-bb99-652603ec7596,Sampai sekarang belum pernah ada kendala.pengiriman selalu cepat.dan sesuai dengan pesanan.dan juga amanah ğŸ™ğŸ‘Œ,"['kendala', 'pengiriman', 'cepat', 'sesuai', 'pesanan', 'amanah']","[('kendala', 'pengiriman'), ('pengiriman', 'cepat'), ('cepat', 'sesuai'), ('sesuai', 'pesanan'), ('pesanan', 'amanah')]",1
672,bf2a2cb0-cfc9-46ad-b908-38717bd0635b,"Memudahkan transportasi dan pengiriman dikala urgent, smoga amanah terus ya..","['memudahkan', 'transportasi', 'pengiriman', 'dikala', 'urgent', 'smoga', 'amanah', 'ya']","[('memudahkan', 'transportasi'), ('transportasi', 'pengiriman'), ('pengiriman', 'dikala'), ('dikala', 'urgent'), ('urgent', 'smoga'), ('smoga', 'amanah'), ('amanah', 'ya')]",1
673,8daff11a-af47-4ba9-b587-d3bdd52f0630,Terbantu dengan adanya aplikasi gojek apalagi buat anak sekolah yang diburu waktu cuma klo buat anak sekolah bisa ngga ongkosnya dibedain terlalu berat untuk berlangganan karena masih ada ongkos yang lebih murah dengan tidak menggunakan aplikasi tank you..,"['terbantu', 'aplikasi', 'gojek', 'anak', 'sekolah', 'diburu', 'klo', 'anak', 'sekolah', 'ngga', 'ongkosnya', 'dibedain', 'berat', 'berlangganan', 'ongkos', 'murah', 'aplikasi', 'tank', 'you']","[('terbantu', 'aplikasi'), ('aplikasi', 'gojek'), ('gojek', 'anak'), ('anak', 'sekolah'), ('sekolah', 'diburu'), ('diburu', 'klo'), ('klo', 'anak'), ('anak', 'sekolah'), ('sekolah', 'ngga'), ('ngga', 'ongkosnya'), ('ongkosnya', 'dibedain'), ('dibedain', 'berat'), ('berat', 'berlangganan'), ('berlangganan', 'ongkos'), ('ongkos', 'murah'), ('murah', 'aplikasi'), ('aplikasi', 'tank'), ('tank', 'you')]",1
674,eba11a84-8f5c-4581-b935-0c7930474843,Paylater limit gak pernah naik. Padahal sering dipakai. Sebulan bisa 3 kali bayar. Pinjem bayar pinjem bayar. Tapi limit gk naik2. Promo gak ada. Promo cuma buat akun2 baru. Akun lama diabaikan. Payah,"['paylater', 'limit', 'gak', 'dipakai', 'sebulan', 'kali', 'bayar', 'pinjem', 'bayar', 'pinjem', 'bayar', 'limit', 'gk', 'promo', 'gak', 'promo', 'akun', 'akun', 'diabaikan', 'payah']","[('paylater', 'limit'), ('limit', 'gak'), ('gak', 'dipakai'), ('dipakai', 'sebulan'), ('sebulan', 'kali'), ('kali', 'bayar'), ('bayar', 'pinjem'), ('pinjem', 'bayar'), ('bayar', 'pinjem'), ('pinjem', 'bayar'), ('bayar', 'limit'), ('limit', 'gk'), ('gk', 'promo'), ('promo', 'gak'), ('gak', 'promo'), ('promo', 'akun'), ('akun', 'akun'), ('akun', 'diabaikan'), ('diabaikan', 'payah')]",1
675,50c489ef-d799-4d4e-bc45-f3f8be8f1566,Sangat membantu di kala membutuhkan jasa transportasi yang cepat dan aman,"['membantu', 'membutuhkan', 'jasa', 'transportasi', 'cepat', 'aman']","[('membantu', 'membutuhkan'), ('membutuhkan', 'jasa'), ('jasa', 'transportasi'), ('transportasi', 'cepat'), ('cepat', 'aman')]",1
676,cae5c4ae-c1c2-4ac9-abd1-9b5acb21ce89,"Semakin di tingkat kan lagi sistem nya,kemaren sempat kecewa tp sekarang semoga lebih baik lagi","['tingkat', 'sistem', 'nya', 'kemaren', 'kecewa', 'tp', 'semoga']","[('tingkat', 'sistem'), ('sistem', 'nya'), ('nya', 'kemaren'), ('kemaren', 'kecewa'), ('kecewa', 'tp'), ('tp', 'semoga')]",1
677,407d5212-7a87-4ddb-a803-e01730df3fde,"Oke aplikasinya, terus tingkatkan pelayanannya","['oke', 'aplikasinya', 'tingkatkan', 'pelayanannya']","[('oke', 'aplikasinya'), ('aplikasinya', 'tingkatkan'), ('tingkatkan', 'pelayanannya')]",1
678,401e86b6-db16-4583-92d8-6ea536c17bd4,baguss kalau gofood tp makanannya ga sesuai nanti langsung di refund uangnya ğŸ¥°,"['baguss', 'gofood', 'tp', 'makanannya', 'ga', 'sesuai', 'langsung', 'refund', 'uangnya']","[('baguss', 'gofood'), ('gofood', 'tp'), ('tp', 'makanannya'), ('makanannya', 'ga'), ('ga', 'sesuai'), ('sesuai', 'langsung'), ('langsung', 'refund'), ('refund', 'uangnya')]",1
679,170c9f79-7145-433d-ae22-54b94e3bbca2,"saya sudah lama pakai aplikasi ini dan tidak pelit bintang dan tip walaupun kadang layanan yg diberikan beberapa driver sangat2 parah dan fidak sesuai SOP , tapi entah knp setelah ada driver yg kurang ajar & saya laporkan sehingga dia di suspen, dan sejak saat itu pula saya tidak bisa menggunakan aplikasi ini kalau mau memesan ada notif kira kira bunyinya begini : ""SERVER PENUH COBA SEBENTAR LAGI"" sudah jalan beberapa bulan sampai saat ini TOLONG DI ATTENSI INI DAN JELASKAN MAKSUDNYA APA !!!","['pakai', 'aplikasi', 'pelit', 'bintang', 'tip', 'kadang', 'layanan', 'yg', 'driver', 'parah', 'fidak', 'sesuai', 'sop', 'knp', 'driver', 'yg', 'ajar', 'laporkan', 'suspen', 'aplikasi', 'memesan', 'notif', 'bunyinya', 'server', 'penuh', 'coba', 'sebentar', 'jalan', 'tolong', 'attensi', 'maksudnya']","[('pakai', 'aplikasi'), ('aplikasi', 'pelit'), ('pelit', 'bintang'), ('bintang', 'tip'), ('tip', 'kadang'), ('kadang', 'layanan'), ('layanan', 'yg'), ('yg', 'driver'), ('driver', 'parah'), ('parah', 'fidak'), ('fidak', 'sesuai'), ('sesuai', 'sop'), ('sop', 'knp'), ('knp', 'driver'), ('driver', 'yg'), ('yg', 'ajar'), ('ajar', 'laporkan'), ('laporkan', 'suspen'), ('suspen', 'aplikasi'), ('aplikasi', 'memesan'), ('memesan', 'notif'), ('notif', 'bunyinya'), ('bunyinya', 'server'), ('server', 'penuh'), ('penuh', 'coba'), ('coba', 'sebentar'), ('sebentar', 'jalan'), ('jalan', 'tolong'), ('tolong', 'attensi'), ('attensi', 'maksudnya')]",1
