no,id,text,token_1,token_2,polarity
413,fc53d1c2-30e2-4b6b-887f-24f0c8176588,Kenapa aplikasi gojek saya tidak bisa di buka sudah coba uninstal tetep tidak bisa di buka padahal di aplikasinya masih ada saldo 100k sungguh menyebalkanğŸ˜­ğŸ˜­ğŸ˜­ğŸ˜­ğŸ˜­ğŸ˜­ğŸ˜­,"['aplikasi', 'gojek', 'buka', 'coba', 'uninstal', 'tetep', 'buka', 'aplikasinya', 'saldo', 'k', 'sungguh', 'menyebalkan']","[('aplikasi', 'gojek'), ('gojek', 'buka'), ('buka', 'coba'), ('coba', 'uninstal'), ('uninstal', 'tetep'), ('tetep', 'buka'), ('buka', 'aplikasinya'), ('aplikasinya', 'saldo'), ('saldo', 'k'), ('k', 'sungguh'), ('sungguh', 'menyebalkan')]",-1
414,8833594b-3e1a-4e2a-bf74-10909c1b8bd1,"Sangat buruk dan mengecewakan pelayanan transfer gopay ke bank terutama bank BRI sangat lama pdhl ke bank lain begitu tf langsung terima di bank,ini status berhasil tapi uang belum diterima,kalau memang proses ya cantumkan on proses atau pending jgn kasih status berhasil,orang awam mengartikan status berhasil itu berhasil tf dan uang nya sdh masuk...uang jg akan segera digunakan tapi lelet,cs pertama blg tggu hari ini sampe jam 23.59 lalu keesokan hari dtlpn lagi cs kedua blg hari ini lg dtggu.","['buruk', 'mengecewakan', 'pelayanan', 'transfer', 'gopay', 'bank', 'bank', 'bri', 'pdhl', 'bank', 'tf', 'langsung', 'terima', 'bank', 'status', 'berhasil', 'uang', 'diterima', 'proses', 'ya', 'cantumkan', 'on', 'proses', 'pending', 'jgn', 'kasih', 'status', 'berhasil', 'orang', 'awam', 'mengartikan', 'status', 'berhasil', 'berhasil', 'tf', 'uang', 'nya', 'sdh', 'masuk', 'uang', 'jg', 'lelet', 'cs', 'blg', 'tggu', 'sampe', 'jam', 'keesokan', 'dtlpn', 'cs', 'blg', 'lg', 'dtggu']","[('buruk', 'mengecewakan'), ('mengecewakan', 'pelayanan'), ('pelayanan', 'transfer'), ('transfer', 'gopay'), ('gopay', 'bank'), ('bank', 'bank'), ('bank', 'bri'), ('bri', 'pdhl'), ('pdhl', 'bank'), ('bank', 'tf'), ('tf', 'langsung'), ('langsung', 'terima'), ('terima', 'bank'), ('bank', 'status'), ('status', 'berhasil'), ('berhasil', 'uang'), ('uang', 'diterima'), ('diterima', 'proses'), ('proses', 'ya'), ('ya', 'cantumkan'), ('cantumkan', 'on'), ('on', 'proses'), ('proses', 'pending'), ('pending', 'jgn'), ('jgn', 'kasih'), ('kasih', 'status'), ('status', 'berhasil'), ('berhasil', 'orang'), ('orang', 'awam'), ('awam', 'mengartikan'), ('mengartikan', 'status'), ('status', 'berhasil'), ('berhasil', 'berhasil'), ('berhasil', 'tf'), ('tf', 'uang'), ('uang', 'nya'), ('nya', 'sdh'), ('sdh', 'masuk'), ('masuk', 'uang'), ('uang', 'jg'), ('jg', 'lelet'), ('lelet', 'cs'), ('cs', 'blg'), ('blg', 'tggu'), ('tggu', 'sampe'), ('sampe', 'jam'), ('jam', 'keesokan'), ('keesokan', 'dtlpn'), ('dtlpn', 'cs'), ('cs', 'blg'), ('blg', 'lg'), ('lg', 'dtggu')]",-1
415,fd81a472-9ce8-4287-a00e-1f72ff20fe36,"Aplikasi apaan Kouta banyak sinyal bagus buka yg lain lancar pas Bukak ini lel35 minta ampun, mau pesan makanan aja susah bgt, payah da tutup aja kantor mu","['aplikasi', 'kouta', 'sinyal', 'bagus', 'buka', 'yg', 'lancar', 'pas', 'bukak', 'lel', 'ampun', 'pesan', 'makanan', 'aja', 'susah', 'bgt', 'payah', 'da', 'tutup', 'aja', 'kantor', 'mu']","[('aplikasi', 'kouta'), ('kouta', 'sinyal'), ('sinyal', 'bagus'), ('bagus', 'buka'), ('buka', 'yg'), ('yg', 'lancar'), ('lancar', 'pas'), ('pas', 'bukak'), ('bukak', 'lel'), ('lel', 'ampun'), ('ampun', 'pesan'), ('pesan', 'makanan'), ('makanan', 'aja'), ('aja', 'susah'), ('susah', 'bgt'), ('bgt', 'payah'), ('payah', 'da'), ('da', 'tutup'), ('tutup', 'aja'), ('aja', 'kantor'), ('kantor', 'mu')]",-1
416,b92e73ae-0dbd-4ef8-ac14-5222b006a2cc,"Aplikasi makin aneh, pakai voucher gofood gk bisa padahal S&K nya sudah pas. Mending pindah ke aplikasi sebelah","['aplikasi', 'aneh', 'pakai', 'voucher', 'gofood', 'gk', 's', 'k', 'nya', 'pas', 'mending', 'pindah', 'aplikasi', 'sebelah']","[('aplikasi', 'aneh'), ('aneh', 'pakai'), ('pakai', 'voucher'), ('voucher', 'gofood'), ('gofood', 'gk'), ('gk', 's'), ('s', 'k'), ('k', 'nya'), ('nya', 'pas'), ('pas', 'mending'), ('mending', 'pindah'), ('pindah', 'aplikasi'), ('aplikasi', 'sebelah')]",-1
417,cebef4e3-9caf-4a76-a473-c9ae4603241d,"Utk jam2 tertentu (jam2 sepi) gocar sulit utk di dapatkan , krn driver sering menunggu di jam2 ramai utk tarif yg lebih besar ... maaf terpaksa kalau harus menghapus aplikasi ini ... Terlalu kecewa..","['utk', 'jam', 'jam', 'sepi', 'gocar', 'sulit', 'utk', 'dapatkan', 'krn', 'driver', 'menunggu', 'jam', 'ramai', 'utk', 'tarif', 'yg', 'maaf', 'terpaksa', 'menghapus', 'aplikasi', 'kecewa']","[('utk', 'jam'), ('jam', 'jam'), ('jam', 'sepi'), ('sepi', 'gocar'), ('gocar', 'sulit'), ('sulit', 'utk'), ('utk', 'dapatkan'), ('dapatkan', 'krn'), ('krn', 'driver'), ('driver', 'menunggu'), ('menunggu', 'jam'), ('jam', 'ramai'), ('ramai', 'utk'), ('utk', 'tarif'), ('tarif', 'yg'), ('yg', 'maaf'), ('maaf', 'terpaksa'), ('terpaksa', 'menghapus'), ('menghapus', 'aplikasi'), ('aplikasi', 'kecewa')]",-1
418,314d0cef-09e1-4b31-b48b-b0d62728c124,"Kecewa sama sistem gojek sekarang padahal udah lama banget pakai ini aplikasi , sekarang voucher gofood ngga bisa di combo lagi sama voucher resto ğŸ˜­ yaudahlah ke apk sebelah aja","['kecewa', 'sistem', 'gojek', 'udah', 'banget', 'pakai', 'aplikasi', 'voucher', 'gofood', 'ngga', 'combo', 'voucher', 'resto', 'yaudahlah', 'apk', 'sebelah', 'aja']","[('kecewa', 'sistem'), ('sistem', 'gojek'), ('gojek', 'udah'), ('udah', 'banget'), ('banget', 'pakai'), ('pakai', 'aplikasi'), ('aplikasi', 'voucher'), ('voucher', 'gofood'), ('gofood', 'ngga'), ('ngga', 'combo'), ('combo', 'voucher'), ('voucher', 'resto'), ('resto', 'yaudahlah'), ('yaudahlah', 'apk'), ('apk', 'sebelah'), ('sebelah', 'aja')]",-1
419,5d046fe1-c799-49ce-9b37-223bddf05ecd,Baru update kok malah bermasalah sama pengisian gopay pke one klik bca. Terpotong di rekeningku tp topup masik nol... kenapa yaaa harus nunggu 2 hari? Ga secepat dulu klo ada kesalahan,"['update', 'bermasalah', 'pengisian', 'gopay', 'pke', 'one', 'klik', 'bca', 'terpotong', 'rekeningku', 'tp', 'topup', 'masik', 'nol', 'yaaa', 'nunggu', 'ga', 'secepat', 'klo', 'kesalahan']","[('update', 'bermasalah'), ('bermasalah', 'pengisian'), ('pengisian', 'gopay'), ('gopay', 'pke'), ('pke', 'one'), ('one', 'klik'), ('klik', 'bca'), ('bca', 'terpotong'), ('terpotong', 'rekeningku'), ('rekeningku', 'tp'), ('tp', 'topup'), ('topup', 'masik'), ('masik', 'nol'), ('nol', 'yaaa'), ('yaaa', 'nunggu'), ('nunggu', 'ga'), ('ga', 'secepat'), ('secepat', 'klo'), ('klo', 'kesalahan')]",-1
420,c42482fe-c1eb-4417-8a53-4aad49430c3a,Prioritas nya diistimewakan untuk paylater yaa...tidak semua orang mau pakai paylater... jadi tolong untuk pembayaran tunai diberi keringanan yg berarti juga...,"['prioritas', 'nya', 'diistimewakan', 'paylater', 'yaa', 'orang', 'pakai', 'paylater', 'tolong', 'pembayaran', 'tunai', 'keringanan', 'yg']","[('prioritas', 'nya'), ('nya', 'diistimewakan'), ('diistimewakan', 'paylater'), ('paylater', 'yaa'), ('yaa', 'orang'), ('orang', 'pakai'), ('pakai', 'paylater'), ('paylater', 'tolong'), ('tolong', 'pembayaran'), ('pembayaran', 'tunai'), ('tunai', 'keringanan'), ('keringanan', 'yg')]",-1
421,227bd8c1-db12-4896-bf41-477f5e407f29,Hari ini gajelas banget orderannya. Aplikasi udah di update. Tapi semua pesenan ga ada yg bisa.,"['gajelas', 'banget', 'orderannya', 'aplikasi', 'udah', 'update', 'pesenan', 'ga', 'yg']","[('gajelas', 'banget'), ('banget', 'orderannya'), ('orderannya', 'aplikasi'), ('aplikasi', 'udah'), ('udah', 'update'), ('update', 'pesenan'), ('pesenan', 'ga'), ('ga', 'yg')]",-1
422,63b9b657-6c8d-429a-95b9-10152f54cf39,"Voucher gofood gak bisa dipakai 2 hanya milih 1, biaya penangan lebih mahal, padahal dari resto sudah dapat komisi dari driver dapat komisi masih dibebani biaya penanganan yg semakin naik. Nanti balasannya hanya terima kasih sarannya nanti perbaiki lagi padahal tetep aja dari dulu. Pindah ijo sebelah dulu dah.","['voucher', 'gofood', 'gak', 'dipakai', 'milih', 'biaya', 'penangan', 'mahal', 'resto', 'komisi', 'driver', 'komisi', 'dibebani', 'biaya', 'penanganan', 'yg', 'balasannya', 'terima', 'kasih', 'sarannya', 'perbaiki', 'tetep', 'aja', 'pindah', 'ijo', 'sebelah', 'dah']","[('voucher', 'gofood'), ('gofood', 'gak'), ('gak', 'dipakai'), ('dipakai', 'milih'), ('milih', 'biaya'), ('biaya', 'penangan'), ('penangan', 'mahal'), ('mahal', 'resto'), ('resto', 'komisi'), ('komisi', 'driver'), ('driver', 'komisi'), ('komisi', 'dibebani'), ('dibebani', 'biaya'), ('biaya', 'penanganan'), ('penanganan', 'yg'), ('yg', 'balasannya'), ('balasannya', 'terima'), ('terima', 'kasih'), ('kasih', 'sarannya'), ('sarannya', 'perbaiki'), ('perbaiki', 'tetep'), ('tetep', 'aja'), ('aja', 'pindah'), ('pindah', 'ijo'), ('ijo', 'sebelah'), ('sebelah', 'dah')]",-1
423,7090f3e8-1564-4de7-a94a-10b930d849f3,"Gopaylater pas dibuka gabisa diakses, mau bayar tagihan gopay later terhambat. Bikin lporan katanya gopaylaternya gak di blokir, tapi smpe skrng ga bisa diakses. Lewat tokopedia jg g bisa. Laporan lg belum dijawab haha.","['gopaylater', 'pas', 'dibuka', 'gabisa', 'diakses', 'bayar', 'tagihan', 'gopay', 'later', 'terhambat', 'bikin', 'lporan', 'gopaylaternya', 'gak', 'blokir', 'smpe', 'skrng', 'ga', 'diakses', 'tokopedia', 'jg', 'g', 'laporan', 'lg', 'haha']","[('gopaylater', 'pas'), ('pas', 'dibuka'), ('dibuka', 'gabisa'), ('gabisa', 'diakses'), ('diakses', 'bayar'), ('bayar', 'tagihan'), ('tagihan', 'gopay'), ('gopay', 'later'), ('later', 'terhambat'), ('terhambat', 'bikin'), ('bikin', 'lporan'), ('lporan', 'gopaylaternya'), ('gopaylaternya', 'gak'), ('gak', 'blokir'), ('blokir', 'smpe'), ('smpe', 'skrng'), ('skrng', 'ga'), ('ga', 'diakses'), ('diakses', 'tokopedia'), ('tokopedia', 'jg'), ('jg', 'g'), ('g', 'laporan'), ('laporan', 'lg'), ('lg', 'haha')]",-1
424,42a252a1-cf36-4a38-849c-711705f1a043,"Driver banyak pilih pilih orderan, no good, beberapa kali sering nunggu lama padahal di sekitar banyak driver.","['driver', 'pilih', 'pilih', 'orderan', 'no', 'good', 'kali', 'nunggu', 'driver']","[('driver', 'pilih'), ('pilih', 'pilih'), ('pilih', 'orderan'), ('orderan', 'no'), ('no', 'good'), ('good', 'kali'), ('kali', 'nunggu'), ('nunggu', 'driver')]",-1
425,37f19363-a3e6-4936-94b3-07a7a6219898,"Mengubungi akun dengan metode pembayaran lain sangat sulit (tidak bisa), harus banyak memasukkan banyak data","['mengubungi', 'akun', 'metode', 'pembayaran', 'sulit', 'memasukkan', 'data']","[('mengubungi', 'akun'), ('akun', 'metode'), ('metode', 'pembayaran'), ('pembayaran', 'sulit'), ('sulit', 'memasukkan'), ('memasukkan', 'data')]",-1
426,dfcaa22a-1933-4e53-bd02-31069d080696,"Kecewa dgn cs nya, sdh berhari2 sy minta solusi mengenai pencairan saldo gopay saya, SMP hr ini sy blm temukan solusi dan gopay sy blm bs d ambil krn minta upgrade gopay plus. Mau upgrade tdk bs krn aplikasi menolak KTP sy. Pd hal data sdh sesuai dgn dukcapil.","['kecewa', 'dgn', 'cs', 'nya', 'sdh', 'berhari', 'sy', 'solusi', 'pencairan', 'saldo', 'gopay', 'smp', 'hr', 'sy', 'blm', 'temukan', 'solusi', 'gopay', 'sy', 'blm', 'bs', 'd', 'ambil', 'krn', 'upgrade', 'gopay', 'plus', 'upgrade', 'tdk', 'bs', 'krn', 'aplikasi', 'menolak', 'ktp', 'sy', 'pd', 'data', 'sdh', 'sesuai', 'dgn', 'dukcapil']","[('kecewa', 'dgn'), ('dgn', 'cs'), ('cs', 'nya'), ('nya', 'sdh'), ('sdh', 'berhari'), ('berhari', 'sy'), ('sy', 'solusi'), ('solusi', 'pencairan'), ('pencairan', 'saldo'), ('saldo', 'gopay'), ('gopay', 'smp'), ('smp', 'hr'), ('hr', 'sy'), ('sy', 'blm'), ('blm', 'temukan'), ('temukan', 'solusi'), ('solusi', 'gopay'), ('gopay', 'sy'), ('sy', 'blm'), ('blm', 'bs'), ('bs', 'd'), ('d', 'ambil'), ('ambil', 'krn'), ('krn', 'upgrade'), ('upgrade', 'gopay'), ('gopay', 'plus'), ('plus', 'upgrade'), ('upgrade', 'tdk'), ('tdk', 'bs'), ('bs', 'krn'), ('krn', 'aplikasi'), ('aplikasi', 'menolak'), ('menolak', 'ktp'), ('ktp', 'sy'), ('sy', 'pd'), ('pd', 'data'), ('data', 'sdh'), ('sdh', 'sesuai'), ('sesuai', 'dgn'), ('dgn', 'dukcapil')]",-1
427,57aabe8a-e56c-47de-b72b-f9b92c0480a6,pesen sekarang susah cari driver Padahal di sekitar resto banyak yang nongkrong sampe sampe di cancel sistem Aplikasi yg ANEH,"['pesen', 'susah', 'cari', 'driver', 'resto', 'nongkrong', 'sampe', 'sampe', 'cancel', 'sistem', 'aplikasi', 'yg', 'aneh']","[('pesen', 'susah'), ('susah', 'cari'), ('cari', 'driver'), ('driver', 'resto'), ('resto', 'nongkrong'), ('nongkrong', 'sampe'), ('sampe', 'sampe'), ('sampe', 'cancel'), ('cancel', 'sistem'), ('sistem', 'aplikasi'), ('aplikasi', 'yg'), ('yg', 'aneh')]",-1
428,0bf0940b-b764-457c-977f-38fb35129119,"Apk ga guna, mau nyri mkn aja susah. Smua dpt promo, gilirak gofood gaada. Promo udh mncapai maksimum juga ga bisa.","['apk', 'ga', 'nyri', 'mkn', 'aja', 'susah', 'smua', 'dpt', 'promo', 'gilirak', 'gofood', 'gaada', 'promo', 'udh', 'mncapai', 'maksimum', 'ga']","[('apk', 'ga'), ('ga', 'nyri'), ('nyri', 'mkn'), ('mkn', 'aja'), ('aja', 'susah'), ('susah', 'smua'), ('smua', 'dpt'), ('dpt', 'promo'), ('promo', 'gilirak'), ('gilirak', 'gofood'), ('gofood', 'gaada'), ('gaada', 'promo'), ('promo', 'udh'), ('udh', 'mncapai'), ('mncapai', 'maksimum'), ('maksimum', 'ga')]",-1
429,9fe36775-784c-4adb-9edc-71a7e26fcce3,Di saat yg oren transfer mudah kemana - mana.. ini masih banyak acara pake upgrade plus plus segala foto ktp dll.,"['yg', 'oren', 'transfer', 'mudah', 'kemana', 'acara', 'pake', 'upgrade', 'plus', 'plus', 'foto', 'ktp', 'dll']","[('yg', 'oren'), ('oren', 'transfer'), ('transfer', 'mudah'), ('mudah', 'kemana'), ('kemana', 'acara'), ('acara', 'pake'), ('pake', 'upgrade'), ('upgrade', 'plus'), ('plus', 'plus'), ('plus', 'foto'), ('foto', 'ktp'), ('ktp', 'dll')]",-1
430,f493d3cd-88e7-4822-a334-79c7132115be,Semalam tarik tunai tanpa kartu ATM ke BCA..dari jam 21:15 s/d hari ini jam 10 lewat belum dapat KODE TRANSAKSI. di aplikasi 10 menit OTOMATIS GAGAL..ternyata HOAX .sy sudah 12 jam lebih uang di gantung..tetap dalam keterangan DALAM PROSES sampai saat ini..dan SALDO BELUM KEMBALI apa perlu saya tulis ke MEDIA KONSUMEN sudah kirim email GAK ADA BALASAN.ğŸ˜¤ğŸ˜¤ğŸ˜¤ğŸ˜¤ğŸ˜¤,"['semalam', 'tarik', 'tunai', 'kartu', 'atm', 'bca', 'jam', 's', 'd', 'jam', 'kode', 'transaksi', 'aplikasi', 'menit', 'otomatis', 'gagal', 'hoax', 'sy', 'jam', 'uang', 'gantung', 'keterangan', 'proses', 'saldo', 'tulis', 'media', 'konsumen', 'kirim', 'email', 'gak', 'balasan']","[('semalam', 'tarik'), ('tarik', 'tunai'), ('tunai', 'kartu'), ('kartu', 'atm'), ('atm', 'bca'), ('bca', 'jam'), ('jam', 's'), ('s', 'd'), ('d', 'jam'), ('jam', 'kode'), ('kode', 'transaksi'), ('transaksi', 'aplikasi'), ('aplikasi', 'menit'), ('menit', 'otomatis'), ('otomatis', 'gagal'), ('gagal', 'hoax'), ('hoax', 'sy'), ('sy', 'jam'), ('jam', 'uang'), ('uang', 'gantung'), ('gantung', 'keterangan'), ('keterangan', 'proses'), ('proses', 'saldo'), ('saldo', 'tulis'), ('tulis', 'media'), ('media', 'konsumen'), ('konsumen', 'kirim'), ('kirim', 'email'), ('email', 'gak'), ('gak', 'balasan')]",-1
431,e82801a8-09e8-4fb8-84a6-e238c5ebd2ed,Sangat buruk pelayanan nya setiap transaksi pembayaran dibatasi hanya bisa 5 kali ..ini saya sudah satu bulan gak pake ..pas saya pake karna ada promosi di Indomaret sama Alfamart eh taunya gak bisa digunakan..saya sakit hati uang saya 115.000 terbuang begitu saja ..aplikasi apa ini kaak..berani ngadain promo tapi gak bisa dipake,"['buruk', 'pelayanan', 'nya', 'transaksi', 'pembayaran', 'dibatasi', 'kali', 'gak', 'pake', 'pas', 'pake', 'karna', 'promosi', 'indomaret', 'alfamart', 'eh', 'taunya', 'gak', 'sakit', 'hati', 'uang', 'terbuang', 'aplikasi', 'kaak', 'berani', 'ngadain', 'promo', 'gak', 'dipake']","[('buruk', 'pelayanan'), ('pelayanan', 'nya'), ('nya', 'transaksi'), ('transaksi', 'pembayaran'), ('pembayaran', 'dibatasi'), ('dibatasi', 'kali'), ('kali', 'gak'), ('gak', 'pake'), ('pake', 'pas'), ('pas', 'pake'), ('pake', 'karna'), ('karna', 'promosi'), ('promosi', 'indomaret'), ('indomaret', 'alfamart'), ('alfamart', 'eh'), ('eh', 'taunya'), ('taunya', 'gak'), ('gak', 'sakit'), ('sakit', 'hati'), ('hati', 'uang'), ('uang', 'terbuang'), ('terbuang', 'aplikasi'), ('aplikasi', 'kaak'), ('kaak', 'berani'), ('berani', 'ngadain'), ('ngadain', 'promo'), ('promo', 'gak'), ('gak', 'dipake')]",-1
432,3c5ed3e3-e9dd-4bea-be28-a8d44278ce03,"Bintangnya gue kurangin, pdhl udh langganan bgt pesen gofood. Eh tiba2 diupdate gabisa pake 2vocher lg. Gmna sih gak konsisten bgt, ngilangin pelanggan.","['bintangnya', 'gue', 'kurangin', 'pdhl', 'udh', 'langganan', 'bgt', 'pesen', 'gofood', 'eh', 'diupdate', 'gabisa', 'pake', 'vocher', 'lg', 'gmna', 'sih', 'gak', 'konsisten', 'bgt', 'ngilangin', 'pelanggan']","[('bintangnya', 'gue'), ('gue', 'kurangin'), ('kurangin', 'pdhl'), ('pdhl', 'udh'), ('udh', 'langganan'), ('langganan', 'bgt'), ('bgt', 'pesen'), ('pesen', 'gofood'), ('gofood', 'eh'), ('eh', 'diupdate'), ('diupdate', 'gabisa'), ('gabisa', 'pake'), ('pake', 'vocher'), ('vocher', 'lg'), ('lg', 'gmna'), ('gmna', 'sih'), ('sih', 'gak'), ('gak', 'konsisten'), ('konsisten', 'bgt'), ('bgt', 'ngilangin'), ('ngilangin', 'pelanggan')]",-1
433,7a52af09-91e5-48cf-b311-60bf7ae3a92b,Setiap buka aplikasi slalu terclose sndiri di coba berulangkali tetep sama smp di uninstall jg tetep sm suka terclose sndiri pdahal sinyal WiFi kenceng gk ada kendala dan sblumnya gk prnh kejadian ky gini gmn bs mw di pake aplikasinya klo ky gini. PAYAH !!!,"['buka', 'aplikasi', 'slalu', 'terclose', 'sndiri', 'coba', 'berulangkali', 'tetep', 'smp', 'uninstall', 'jg', 'tetep', 'sm', 'suka', 'terclose', 'sndiri', 'pdahal', 'sinyal', 'wifi', 'kenceng', 'gk', 'kendala', 'sblumnya', 'gk', 'prnh', 'kejadian', 'ky', 'gini', 'gmn', 'bs', 'mw', 'pake', 'aplikasinya', 'klo', 'ky', 'gini', 'payah']","[('buka', 'aplikasi'), ('aplikasi', 'slalu'), ('slalu', 'terclose'), ('terclose', 'sndiri'), ('sndiri', 'coba'), ('coba', 'berulangkali'), ('berulangkali', 'tetep'), ('tetep', 'smp'), ('smp', 'uninstall'), ('uninstall', 'jg'), ('jg', 'tetep'), ('tetep', 'sm'), ('sm', 'suka'), ('suka', 'terclose'), ('terclose', 'sndiri'), ('sndiri', 'pdahal'), ('pdahal', 'sinyal'), ('sinyal', 'wifi'), ('wifi', 'kenceng'), ('kenceng', 'gk'), ('gk', 'kendala'), ('kendala', 'sblumnya'), ('sblumnya', 'gk'), ('gk', 'prnh'), ('prnh', 'kejadian'), ('kejadian', 'ky'), ('ky', 'gini'), ('gini', 'gmn'), ('gmn', 'bs'), ('bs', 'mw'), ('mw', 'pake'), ('pake', 'aplikasinya'), ('aplikasinya', 'klo'), ('klo', 'ky'), ('ky', 'gini'), ('gini', 'payah')]",-1
434,3d837893-9ac7-4862-82f6-30d4bedd7d1b,Apakah aplikasi gojek sudah tidak bisa dipakai lagi di android 5.0 ? Karena kalau saya mau pesan selalu lambat aksesnya padahal paket data saya masih lumayan banyak,"['aplikasi', 'gojek', 'dipakai', 'android', 'pesan', 'lambat', 'aksesnya', 'paket', 'data', 'lumayan']","[('aplikasi', 'gojek'), ('gojek', 'dipakai'), ('dipakai', 'android'), ('android', 'pesan'), ('pesan', 'lambat'), ('lambat', 'aksesnya'), ('aksesnya', 'paket'), ('paket', 'data'), ('data', 'lumayan')]",-1
435,ddfeee90-1149-4cdc-a4a9-2a976727a8b0,"Hari ini sabtu 26 november 2022 apk customer eror! Customer tidak bisa pesan dikarenakan lokasi gps nya tidak muncul,dampaknya ke driver orderan masuk tapi ke cancel sendiri dari sistem","['sabtu', 'november', 'apk', 'customer', 'eror', 'customer', 'pesan', 'lokasi', 'gps', 'nya', 'muncul', 'dampaknya', 'driver', 'orderan', 'masuk', 'cancel', 'sistem']","[('sabtu', 'november'), ('november', 'apk'), ('apk', 'customer'), ('customer', 'eror'), ('eror', 'customer'), ('customer', 'pesan'), ('pesan', 'lokasi'), ('lokasi', 'gps'), ('gps', 'nya'), ('nya', 'muncul'), ('muncul', 'dampaknya'), ('dampaknya', 'driver'), ('driver', 'orderan'), ('orderan', 'masuk'), ('masuk', 'cancel'), ('cancel', 'sistem')]",-1
436,64b4d012-6d56-4335-b32b-0696e6082c7f,"Sekarang kenapa ga bisa dua promo ya di go food? Saya suka sekali dan sering banget go food hampir setiap hari, tapi sekarang fiturnya cuma bisa 1 voucher ga bisa di gabung kaya sebelumnya, jadi maaf deh, ga make app ini lagi dan ga nyaranin buat temen-temen yg mau makan murah via go food lagi ğŸ™ğŸ¼","['ga', 'promo', 'ya', 'go', 'food', 'suka', 'banget', 'go', 'food', 'fiturnya', 'voucher', 'ga', 'gabung', 'kaya', 'maaf', 'deh', 'ga', 'make', 'app', 'ga', 'nyaranin', 'temen', 'temen', 'yg', 'makan', 'murah', 'via', 'go', 'food']","[('ga', 'promo'), ('promo', 'ya'), ('ya', 'go'), ('go', 'food'), ('food', 'suka'), ('suka', 'banget'), ('banget', 'go'), ('go', 'food'), ('food', 'fiturnya'), ('fiturnya', 'voucher'), ('voucher', 'ga'), ('ga', 'gabung'), ('gabung', 'kaya'), ('kaya', 'maaf'), ('maaf', 'deh'), ('deh', 'ga'), ('ga', 'make'), ('make', 'app'), ('app', 'ga'), ('ga', 'nyaranin'), ('nyaranin', 'temen'), ('temen', 'temen'), ('temen', 'yg'), ('yg', 'makan'), ('makan', 'murah'), ('murah', 'via'), ('via', 'go'), ('go', 'food')]",-1
437,2cff97ba-0f58-4df0-b497-407ca348e88f,udh uninstal gojek nya...males ga pernah promo. aplikasi jelek. telat bayar payleter nagih nya kasar lewat tlp. udh selesai di bayar lunas malah di blokir permanen...kecewa sekali.,"['udh', 'uninstal', 'gojek', 'nya', 'males', 'ga', 'promo', 'aplikasi', 'jelek', 'telat', 'bayar', 'payleter', 'nagih', 'nya', 'kasar', 'tlp', 'udh', 'selesai', 'bayar', 'lunas', 'blokir', 'permanen', 'kecewa']","[('udh', 'uninstal'), ('uninstal', 'gojek'), ('gojek', 'nya'), ('nya', 'males'), ('males', 'ga'), ('ga', 'promo'), ('promo', 'aplikasi'), ('aplikasi', 'jelek'), ('jelek', 'telat'), ('telat', 'bayar'), ('bayar', 'payleter'), ('payleter', 'nagih'), ('nagih', 'nya'), ('nya', 'kasar'), ('kasar', 'tlp'), ('tlp', 'udh'), ('udh', 'selesai'), ('selesai', 'bayar'), ('bayar', 'lunas'), ('lunas', 'blokir'), ('blokir', 'permanen'), ('permanen', 'kecewa')]",-1
438,180ca529-fbc9-499b-94e4-2d7b0b9d4a42,"Jatuh tempo Gopaylater baiknya diatas tgl 6 setiap bulan'nya karna kadang tgl 10 baru gajian, lha ini tgl 1 setiap bulan udah jatuh tempo suruh bayar, ya keteteranlah!!. ğŸ¥²","['jatuh', 'tempo', 'gopaylater', 'baiknya', 'diatas', 'tgl', 'nya', 'karna', 'kadang', 'tgl', 'gajian', 'lha', 'tgl', 'udah', 'jatuh', 'tempo', 'suruh', 'bayar', 'ya', 'keteteranlah']","[('jatuh', 'tempo'), ('tempo', 'gopaylater'), ('gopaylater', 'baiknya'), ('baiknya', 'diatas'), ('diatas', 'tgl'), ('tgl', 'nya'), ('nya', 'karna'), ('karna', 'kadang'), ('kadang', 'tgl'), ('tgl', 'gajian'), ('gajian', 'lha'), ('lha', 'tgl'), ('tgl', 'udah'), ('udah', 'jatuh'), ('jatuh', 'tempo'), ('tempo', 'suruh'), ('suruh', 'bayar'), ('bayar', 'ya'), ('ya', 'keteteranlah')]",-1
439,ffd58883-7e28-4cb3-808a-93ddc469584e,"Super RIBETT,, mau masuk akun aja pake acara ""wah nyobanya kebanyakan"" aplikasi aneh.. Sumpah mending pake GRAB SUPERAPP..!! ga Ribett","['super', 'ribett', 'masuk', 'akun', 'aja', 'pake', 'acara', 'nyobanya', 'kebanyakan', 'aplikasi', 'aneh', 'sumpah', 'mending', 'pake', 'grab', 'superapp', 'ga', 'ribett']","[('super', 'ribett'), ('ribett', 'masuk'), ('masuk', 'akun'), ('akun', 'aja'), ('aja', 'pake'), ('pake', 'acara'), ('acara', 'nyobanya'), ('nyobanya', 'kebanyakan'), ('kebanyakan', 'aplikasi'), ('aplikasi', 'aneh'), ('aneh', 'sumpah'), ('sumpah', 'mending'), ('mending', 'pake'), ('pake', 'grab'), ('grab', 'superapp'), ('superapp', 'ga'), ('ga', 'ribett')]",-1
440,d756c0c8-d357-4a8a-b7bd-75bba3052806,Pesan gocar masih sering terjadi double order... Kasihan mitra drivernya. Tolong diperbaiki sistemnya!,"['pesan', 'gocar', 'double', 'order', 'kasihan', 'mitra', 'drivernya', 'tolong', 'diperbaiki', 'sistemnya']","[('pesan', 'gocar'), ('gocar', 'double'), ('double', 'order'), ('order', 'kasihan'), ('kasihan', 'mitra'), ('mitra', 'drivernya'), ('drivernya', 'tolong'), ('tolong', 'diperbaiki'), ('diperbaiki', 'sistemnya')]",-1
441,9b77e65b-a4d9-45ae-a243-c3686347c641,"saya kecewa sama drivernya sekarang,di gojek bagus banyak promo tetapi kenapa drivernya ga mau ngambil? padah saya juga bakalan kasih tip walau pun promo, KALO GA NIAT GA USAH KEBAYAKAN PROMO ONGKIR TAPI DRIVER GA MAU NGANTER,ANEH!!","['kecewa', 'drivernya', 'gojek', 'bagus', 'promo', 'drivernya', 'ga', 'ngambil', 'padah', 'kasih', 'tip', 'promo', 'kalo', 'ga', 'niat', 'ga', 'kebayakan', 'promo', 'ongkir', 'driver', 'ga', 'nganter', 'aneh']","[('kecewa', 'drivernya'), ('drivernya', 'gojek'), ('gojek', 'bagus'), ('bagus', 'promo'), ('promo', 'drivernya'), ('drivernya', 'ga'), ('ga', 'ngambil'), ('ngambil', 'padah'), ('padah', 'kasih'), ('kasih', 'tip'), ('tip', 'promo'), ('promo', 'kalo'), ('kalo', 'ga'), ('ga', 'niat'), ('niat', 'ga'), ('ga', 'kebayakan'), ('kebayakan', 'promo'), ('promo', 'ongkir'), ('ongkir', 'driver'), ('driver', 'ga'), ('ga', 'nganter'), ('nganter', 'aneh')]",-1
442,2600a5c8-1ad4-4255-bbf7-4dde8ee8b1aa,"Gopay saya diblockir tanpe sebab! Dibilang melakukan aktivitas yang tidak wajar tapi tidak ada penjelasan sama sekali. Ketika saya melapor malah di selesaikan padahal belum ada penjelasan sama sekali.. tolong pihak gojek tanggung jawabnya! Disitu masih ada saldo saya yang saya gunakan untuk berbisnis, kalau emang gabisa di buka block tolong kembalikan saldo saya, saya merasa dirugikan.","['gopay', 'diblockir', 'tanpe', 'dibilang', 'aktivitas', 'wajar', 'penjelasan', 'melapor', 'selesaikan', 'penjelasan', 'tolong', 'gojek', 'tanggung', 'disitu', 'saldo', 'berbisnis', 'emang', 'gabisa', 'buka', 'block', 'tolong', 'kembalikan', 'saldo', 'dirugikan']","[('gopay', 'diblockir'), ('diblockir', 'tanpe'), ('tanpe', 'dibilang'), ('dibilang', 'aktivitas'), ('aktivitas', 'wajar'), ('wajar', 'penjelasan'), ('penjelasan', 'melapor'), ('melapor', 'selesaikan'), ('selesaikan', 'penjelasan'), ('penjelasan', 'tolong'), ('tolong', 'gojek'), ('gojek', 'tanggung'), ('tanggung', 'disitu'), ('disitu', 'saldo'), ('saldo', 'berbisnis'), ('berbisnis', 'emang'), ('emang', 'gabisa'), ('gabisa', 'buka'), ('buka', 'block'), ('block', 'tolong'), ('tolong', 'kembalikan'), ('kembalikan', 'saldo'), ('saldo', 'dirugikan')]",-1
